Product Name,Old Price,New Price,Discount,Rating,Ratings Count,Rating Range
AILYONS HD-199A Electric Dry Iron Box Silver & Black (1YR WRTY),1399,929,34,3.8,1398,"(3, 4]"
Fashion 6Pcs Soft Cotton Checked Men's Boxers – Multicolor,0,618,0,3.6,2200,"(3, 4]"
NIVEA UV Face Shine Control Cream SPF 50 - 50ml,1300,975,25,4.4,4409,"(4, 5]"
RichRipple LED Display Bluetooth Headsets 9D Stereo Wireless Earphones Earpods,920,519,44,3.7,703,"(3, 4]"
AILYONS FK-0310 Stainless Steel 2.2L Electric Water Kettle-Black (1YR WRTY),1599,902,44,3.9,926,"(3, 4]"
NIVEA Perfect & Radiant Even Tone Day And Night Cream For Women - 50ml,1800,1058,41,4.3,3341,"(4, 5]"
Garnier Even & Matte Vitamin  C Booster Serum 30ml.,1750,1050,40,4.3,4522,"(4, 5]"
Garnier Even & Matte Vitamin C Protection Cream SPF30 50ml,1250,910,27,4.2,1664,"(4, 5]"
RichRipple Pro3 Bluetooth Headsets Wireless Pods Pro Earpods Earphones,754,499,34,4.1,335,"(4, 5]"
Garnier Bright Complete Bundle Pack,3400,2305,32,4.5,366,"(4, 5]"
Nunix Hair Red Blow Dryer With Beauty Accessories HD-01,1079,800,26,3.6,114,"(3, 4]"
AILYONS TYB-205 Blender 2In1 With GrinderMachine 1.5LBlack (1YR WRTY),2599,1699,35,4.1,624,"(4, 5]"
NIVEA Radiant & Beauty Advanced Care Lotion For Women - 400ml (Pack Of 2),1460,990,32,4.5,1556,"(4, 5]"
Garnier Even & Matte Vitamin C  Booster Serum 15ml,900,651,28,4.1,1188,"(4, 5]"
"Multicolor Duvet Blanket, Sheet, 2 Pillow Cases",29004000,16492099,48,3.8,467,"(3, 4]"
Garnier Pure Active 3 In1 Charcoal  Anti  Blackhead Mask Wash Scrub -150ml,1345,1034,23,4.4,5311,"(4, 5]"
Vintage T9 Dragon Rechargeable Metal Hair Clipper Gold,922,423,54,3.9,858,"(3, 4]"
AILYONS FK-0306 Stainless Steel 1.8L Electric Kettle-White (1YR WRTY),1399,738,47,0.0,1276,
Lyons FY-1731 Blender 2 In 1 With Grinder Machines  1.5L,2599,1599,38,0.0,745,
Garnier Anti-Blemish Charcoal Serum With AHA+BHA & Niacinamide For Acne Prone Skin,1850,1570,15,4.2,2193,"(4, 5]"
Waanzilish Mens Sneakers Shoes Outdoor Hiking Shoes Non-slip Sports Shoes Breathable Blue,1500,1200,20,0.0,614,
RichRipple Rechargeable 2.4G Wireless Slient Mouse Bluetooth 5.0 USB LED Ultrathin Mice,734,406,45,4.4,282,"(4, 5]"
Garnier Even & Matte Vitamin C Cleansing Foam,825,579,30,4.4,2422,"(4, 5]"
Set Of 2 Bed Pillows (Pair- Pure Fibre Filled),0,659,0,0.0,584,
"NIVEA Pearl & Beauty Anti-Perspirant Rollon, 48h - 50ml (Pack Of 2)",1040,728,30,4.5,1297,"(4, 5]"
RichRipple Pro3 Bluetooth Headsets Wireless Pods Pro Earpods Earphones,826,499,40,0.0,332,
Fashion 4 In 1 Ladies Handbags Women Shoulder Bags Set PU Leather -Pink,1505,781,48,3.7,2283,"(3, 4]"
Fashion 4pcs Ladies Handbags Women Shoulder Tote Bags Set PU Leather-Black,1402,895,36,3.5,1799,"(3, 4]"
Garnier Even & Matte Dark Spot Corrector,1090,542,50,0.0,2983,
Ace Elec ACEELEC F9 Wireless Fingerprint Touch Bluetooth Headset,700,390,44,3.8,353,"(3, 4]"
Garnier AHA+BHA Charcoal Serum + Pure Active 3-in-1 Charcoal Mask (Anti Acne Skin Care Kit),3195,2167,32,4.3,723,"(4, 5]"
AILYONS FK-0308 Stainless Steel 2.2L Electric Kettle (1YR WRTY),1599,902,44,4.1,758,"(4, 5]"
RichRipple Pro3 Bluetooth Headsets Wireless Pods Pro Earpods Earphones,826,492,40,4.2,95,"(4, 5]"
Itel ISW-O11 Waterproof Native Storm  Smart Watch,2200,1550,30,4.2,170,"(4, 5]"
Stereo F9 Bluetooth Earphone  Power Headset,932,510,45,3.8,1523,"(3, 4]"
Fashion Couple Canvas Low Top Lace-up Shoes Classic Casual Sneakers Black,1500,850899,43,4.2,221,"(4, 5]"
Fashion Men Shoes Sneakers Skateboarding Shoes Sport Shoes Running Sneakers Casual Shoes,13711913,1011,47,3.9,315,"(3, 4]"
Fashion Mens Sneakers Shoes Sports Shoes Breathable Running Shoes -White,2000,10001300,50,3.8,145,"(3, 4]"
Fashion Mens Sneaker Causal Breathable Shoes Light Weight Walking Shoes,2000,12001400,40,4.2,109,"(4, 5]"
Ace Elec ACEELEC F9 Wireless Fingerprint Touch Bluetooth Headset,700,380,46,3.9,765,"(3, 4]"
"Mosquito Net With Metallic Stand, - Purple",2500,12991469,48,3.9,67,"(3, 4]"
"14""-42"" TV Flat Panel Wall Bracket Holder Black",450,245,46,4.1,2533,"(4, 5]"
NIVEA Nourishing Cocoa Body Lotion With Cocoa Butter 400ml (Pack Of 2),1280,869,32,4.7,1360,"(4, 5]"
10kg Digital Kitchen Electronic Cooking Weighing Scale,800,473,41,4.3,967,"(4, 5]"
Fashion Men's Casual Shoes Sneakers Sports Shoes,10991399,559629,55,3.7,7,"(3, 4]"
Vitron VB-Y44 - 2in1 Blender - 1.5L - 350W - White & Yellow,2999,1820,39,4.1,265,"(4, 5]"
L'Oreal GLYCOLIC BRIGHT FACE CLEANSER FOAM 100ML,850,634,25,4.4,289,"(4, 5]"
Garnier Bye Acne & Dark Spots Skin Care Kit.,4345,2750,37,4.3,912,"(4, 5]"
"NIVEA MEN Deep Antibacterial Anti-Perspirant Rollon,48h - 50ml (Pack Of 2)",1040,659,37,4.5,1256,"(4, 5]"
"Power King Extension Cable With 6 AC Power Outlets, 13A, And 2 M Long Cable",550,480,13,0.0,723,
Wireless Earphones Bluetooth 5.3 Finger Touch Headset HIFI Slide Cover.,1249,650,48,3.8,339,"(3, 4]"
Istanbul 2 Modern TV Stand With LED Lights,14000,6999,50,3.6,111,"(3, 4]"
Garnier Even & Matte Vitamin  C Micellar Cleansing Water - 400ml,775,403,48,4.4,1224,"(4, 5]"
Qwen 64GB Flash Disks USB Flash Drive High Speed,1000,699,30,0.0,401,
Rashnik TV Wall Mount TV Stand For 14” -  42”,0,247,0,4.3,109,"(4, 5]"
Qwen Aluminum Alloy Laptop Stand Computer Stand,1000,560,44,4.5,974,"(4, 5]"
YOIVY Teeth Whitening Essence Tooth Whitener Remove Stains,399,314,21,3.2,117,"(3, 4]"
Fashion 6Pcs Soft Cotton Brief Men's Boxers – Waist 29-35inc,0,899,0,3.7,662,"(3, 4]"
LED 2.4G Rechargeable Wireless Mouse,931,475,49,4.5,1002,"(4, 5]"
Qwen Memory Card 64GB High Speed C10,800,599,25,0.0,162,
Fashion Mens Loafers Shoes Official Leather Loafer Casual Shoes Comfortable Shoes-Black,1000,780,22,3.6,62,"(3, 4]"
Fashion Slipon Shoes Loafers Shoes Canvas Shoes Casual Shoes Mens Sneaker Black,1500,7291500,51,3.7,454,"(3, 4]"
Bluetooth  Earphone  F2  TWS Sports Headset  Touch,400,201,50,3.3,25,"(3, 4]"
Smartwatch Business Bluetooth Waterproof Sport,1074,587,45,3.2,136,"(3, 4]"
Gionee DCQ D1 Power Banks 10000 MAh,1500,750,50,3.9,343,"(3, 4]"
Fashion 6Pcs Pure Cotton Checked Men's Boxers – Multicolor,0,1250,0,3.9,1899,"(3, 4]"
Qwen Bluetooth Earbuds Wireless Headsets Earphone Gaming Earphone Sports Headphones,800,500,38,3.8,40,"(3, 4]"
RichRipple Desktop Mobile Phone Holder Portable Foldable Phone Stands,399,249,38,4.3,102,"(4, 5]"
Fashion Men's Trendy Sneakers - White,2223,1371,38,0.0,175,
"Superfoam Luxury White Fiber Pillow 600gms ( 100% Pure Fiber, Soft Feel) 68 Cm X 43 Cm",962,850,12,4.4,211,"(4, 5]"
RichRipple USB Rechargeable Beard Hair Trimmer Electric Hair Clippers Salon Hair Cutting Kit With Limit Comb,699,449,36,4.2,68,"(4, 5]"
AILYONS FK-0318 Stainless Steel 3.5L Electric Kettle-Ultra Plus Kettle. (1YR WRTY),1999,1453,27,4.3,332,"(4, 5]"
AILYONS FK-0316 Stainless Steel 1.8L Electric Kettle - 1500W - Yellow (1YR WRTY),1499,719,52,4.2,32,"(4, 5]"
Fashion 3 Pieces Of Adjustable Baseball Cap - Multicolour+free Gift,893,549,39,0.0,988,
Garnier Vitamin C Booster Serum 30ml Twin Pack,3500,2215,37,4.5,656,"(4, 5]"
Garnier Brightening Night Serum With 10% Pure Vitamin C,2495,1692,32,4.4,97,"(4, 5]"
Fashion 2024 Mens Casual High-Top Shoes Running Sneakers - Beige,2735,1860,32,4.3,314,"(4, 5]"
Fashion Mens Long Sleeve Dress Shirts - White,1190,551,54,3.7,77,"(3, 4]"
ASHION 2024 Men's Casual Shoes Big Size  Sneakers 39-47,2331,1279,45,4.1,108,"(4, 5]"
HOMMY 3 Column Portable Wardrobe - Brown Cover,4500,2599,42,3.8,775,"(3, 4]"
SiYi Sex Lubricant Water Based Lubricant Sex Lube-215ML,900,455,49,4.2,418,"(4, 5]"
RichRipple 4in1 Pack Phone Camera Tripod Stand 1/4 Screw Head Remote Control Selfie,1499,929,38,4.4,62,"(4, 5]"
Adidas Adilette Aqua Slides Unisex,4600,1999,57,4.2,43,"(4, 5]"
Garnier Even & Matte Normal To Oily Skin Face Moisturizer – 40ml,1090,645,41,3.8,1675,"(3, 4]"
Fashion Men's Soft Sole Leather Shoes - Black,1614,980,39,3.5,192,"(3, 4]"
Fashion Men Bags Chest Bags Crossbody Bags Shoulder Bags Sling Satchel,999,496,50,3.3,73,"(3, 4]"
"6"" Ring Light Mirror For Selfie YouTube Video Phone Holder Stand Shooting With 3 Light Modes",1056,557,47,4.1,241,"(4, 5]"
HOMMY Portable Wardrobe 3 Column - Grey Cover,4000,2599,35,3.8,391,"(3, 4]"
Mara Fenugreek Powder-100g,0,300,0,4.2,87,"(4, 5]"
Fashion Men Leather Loafers & Slip-Ons,1549,817,47,3.3,373,"(3, 4]"
Fashion Men Shoes Loafers Casual Shoes Slip-On Shoes Business Shoes,1398,699,50,3.5,71,"(3, 4]"
Mirror Face 10000mAh Portable Power Charging Bank,1201,790,34,3.6,294,"(3, 4]"
Fashion Sneakers Women Shoes Women's Shoes Ladies,9801048,588,44,3.6,333,"(3, 4]"
AILYONS FK-0317 Stainless Steel 3.5L Electric Kettle-Ultra Plus Kettle (1YR WRTY),3299,1399,58,4.3,167,"(4, 5]"
Qasil Naturals Qasil Powder Organic & Multi-purpose Skincare,900,548,39,4.1,621,"(4, 5]"
HOMMY Maroon Portable Wardrobe 3 Column - Maroon Cover,4000,2499,38,3.7,187,"(3, 4]"
"Home Design ROTATING 14""-55"" TILT ROTATING WALL MOUNT BRACKET",890,880,1,3.9,176,"(3, 4]"
Fashion New Young Fashion Trendy Board Shoes - Blue,26063057,1590,48,0.0,47,
"AILYONS 2.2L  Elegant Automatic Water Heater & Boiler Jug,Cordeless",1499,1219,19,0.0,166,
GUIXIA  F9 Wireless Headset Bluetooth Earphone True Bass With Power Banc,799,445,44,3.6,59,"(3, 4]"
"Rashnik RN-999 Blender & Grinder 1.5 Litres, 400W – Brown",0,1680,0,4.3,46,"(4, 5]"
Fashion  Men's Sneakers Breathable Sports Shoes Walking Style,1000,899,10,3.2,40,"(3, 4]"
RichRipple Purple Metal Desktop Phones & Tablets Holder Foldable Stand,586,329,44,4.3,58,"(4, 5]"
"Mosquito Net With Metallic Stand- Pink- 4*6, 5*6, 6*6",2500,1299,48,4.2,107,"(4, 5]"
RichRipple P9 Bluetooth Headsets Hi-Fi Stereo Noise Reduction Headphone,1377,743,46,3.8,125,"(3, 4]"
Fashion 3 PCS Women Bags Ladies Bags Handbags Purse Shoulder Bags Tote Bags Hobo Bags,1914,1195,38,3.5,351,"(3, 4]"
Fashion 2024 Mens Casual Board Shoes Running Sneakers - White/Black,2373,1590,33,3.7,165,"(3, 4]"
Garnier Pure Active Charcoal Anti-Blackhead Peel-Off Mask,1050,525,50,0.0,183,
UWY 128GB Pendrive Flash  Drive Metal High Speed,1229,630,49,3.6,183,"(3, 4]"
Shoe Rack Stackable Assembly Shoe Clothes Organizer-6 Layers,1999,1199,40,3.9,275,"(3, 4]"
Kemei Flat Iron Hair Straightener Professional,1500,900,40,4.2,880,"(4, 5]"
Big Purple Round Mosquito Net For Single Bed-FREE SIZE.,1500,879,41,4.2,223,"(4, 5]"
Fashion 2024 New Men's Outdoor Casual Trendy Sports Shoes - White,2271,1499,34,3.6,110,"(3, 4]"
Fashion Women 3 Layers Beads Bar Tassel Charm Pendant-Golden,157,89,43,3.6,182,"(3, 4]"
ARHANORY Phone Tripod Stand Mobile Phone Holder Mount Ring Light Set Selfie Stick-Black,782,469,40,0.0,715,
RichRipple Pro2+ Bluetooth Headsets Wireless Pods Pro Earpods Earphones,754,599,21,4.1,207,"(4, 5]"
Fashion Shoes For Women Sneakers Ladies Shoes Sneakers,864,599,31,3.7,269,"(3, 4]"
Maybelline New York Superstay Skin Tint Shade  63 With Vitamin C,2500,2000,20,4.5,37,"(4, 5]"
19Pcs Manicure Nail Clippers Kit Pedicure Set Nail,1129,551,51,0.0,59,
Fashion Men Shoes Loafers Casual Shoes Slip-On Shoes Business Shoes,1156,643,44,3.6,165,"(3, 4]"
Power King Best 4 Way Power Extension With Long Cable - White,450,390,13,4.1,533,"(4, 5]"
Fashion Vintage Breathable High Top Casual Canvas Sneakers,1299,999,23,3.8,51,"(3, 4]"
MK Electric Fridge Guard Plus Free 4-Way Extension Cable,900,870,3,4.1,157,"(4, 5]"
"VON VAMS-20DGX Microwave Oven, Solo, 20L, Digital, Black. (1YR WRTY)",12995,9499,27,4.4,221,"(4, 5]"
Remote Bluetooth Selfie Stick +Tripod Stand + Fill Light  Multiple Function,787,450,43,3.8,275,"(3, 4]"
Garnier Charcoal Serum With AHA+BHA 30ml Twin Pack,3700,2960,20,4.5,341,"(4, 5]"
Power King 2Pcs 6 Way Power Extension Socket 3M Cable,950,899,5,4.2,323,"(4, 5]"
RichRipple Portable Plastic Laptop Stand 10-hole Adjustable Foldable Ipad Computer Stand,642,388,40,4.2,98,"(4, 5]"
Fashion Men Laptop Backpack Business Bag Set Rucksack Travel Bag With USB Jack-Grey,1745,919,47,3.5,36,"(3, 4]"
Fashion Men's Long Sleeve Striped Shirt,1190,551,54,3.6,36,"(3, 4]"
150W LED UV Nail Gel Polish Dryer Lamp Light Machine 4 Timers Nail Dryer,3260,1620,50,4.4,43,"(4, 5]"
Fashion Women Backpack Bag Shoulder Bags PU Leather Travel Bag-Black,1500,999,33,3.9,211,"(3, 4]"
RichRipple Grey Bluetooth Headsets Wireless Pods Pro Earpods Earphones,754,436,42,3.9,131,"(3, 4]"
L'Oreal GLYCOLIC BRIGHT INSTANT GLOWING SERUM 30ML,2300,2049,11,4.6,144,"(4, 5]"
Fashion Fashionable Ladies Shoulder Bag Crossbody Single Shoulder Bag Coin Purse,1500,1250,17,0.0,68,
Oraimo Rock Stereo Bass Super Long Playtime IPX5 Waterproof True Wireless Earbuds,2612,2050,22,4.4,338,"(4, 5]"
Fashion 2 In 1 Men's Short Sleeve Shorts Set,1360,799,41,3.8,54,"(3, 4]"
Fashion 16 Inch Laptop Backpack Bags With USB Waterproof,1553,869,44,3.4,1239,"(3, 4]"
Fashion Women Shoes Ladies Shoes For Women Shoe,10291080,649,40,3.6,194,"(3, 4]"
Oraimo  FreePods Lite ENC 40-hour Playtime Heavybass True Wireless Earbuds,2500,1899,24,4.5,61,"(4, 5]"
Mara Fenugreek Seeds-250g,0,500,0,4.6,132,"(4, 5]"
GUIXIA Tws Wireless Bluetooth Headsets Earphones Inpods12,684,399,42,3.8,126,"(3, 4]"
MK TV Guard Voltage Protector,598,595,1,4.1,175,"(4, 5]"
Fashion Wrist Watche Fashion Iuminous Waterproof Simple Quartz Watch Gold/Brown,1162,560,52,0.0,61,
Tisa Nyota 3 In 1 Ladies Handbags Women Bags Sling Bag-Black,2000,1300,35,3.4,63,"(3, 4]"
Fashion Men'S Button Shirt  Men Casual Print Shirt  Long Sleeved Shirts.,1500,899,40,3.7,17,"(3, 4]"
Fashion 4Pairs Finest Cotton Freesize Unisex Plain Invisible Socks,345,227,34,0.0,2361,
Qwen USB Flash Drive  Flash Disk-32GB  Silver,1000,550,45,4.1,473,"(4, 5]"
RichRipple T500+PRO 2 Smart Watch Band Health Monitor Smart Watches,1929,1115,42,3.7,38,"(3, 4]"
Maybelline Lasting Fix Setting Spray,2220,1665,25,4.5,1701,"(4, 5]"
Fashion Men Shoes Sneakers Sport Shoes Casual Shoes Outdoor Shoes Running Shoes,1861,1011,46,3.4,152,"(3, 4]"
Rhinestone Alloy Ring Set 7-piece Celestial Rhinestone Ring for Women ,280,186,34,3.8,31,"(3, 4]"
"Geemy Rechargeable Hair Shaving Machine, Shaver- 3 In 1",999,950,5,4.1,672,"(4, 5]"
F9 Bluetooth Earbuds High Sound Quality Fingerprint Touch Pod,1000,550,45,3.9,61,"(3, 4]"
2PCs Sexy Strappy Ice Silk Seamless Ladies Panties ,699,499,29,4.3,74,"(4, 5]"
Power King Heavy Duty 4-Way Extension Cable,450,390,13,3.8,188,"(3, 4]"
"NIVEA Pearl & Beauty Black Pearl Fine Fragrance Anti-Perspirant Roll-On, 48h - 50ml (Pack Of 2)",1040,728,30,4.5,408,"(4, 5]"
Fashion Women Shoes Sandals Heels Ladies Shoes Casual Shoes,1999,1099,45,3.8,89,"(3, 4]"
Vitron VB-886 - 2in1 Blender - 1.5L - 350W - White,2999,1820,39,3.9,171,"(3, 4]"
Sundabest Glass Jug (21114),0,360,0,4.3,38,"(4, 5]"
Foldable Portable Laptop Stand With Mobile Phone Stand 2 In 1,1490,766,49,4.3,123,"(4, 5]"
Adidas Adilette Aqua Slides Unisex,4600,1999,57,4.4,23,"(4, 5]"
Men's Cartoon Printed Elasticated High Waist Casual Summer Shorts,546,339,38,4.1,36,"(4, 5]"
Efero Foot Exfoliating Mask Foot Peeling Lavender Essenc,500,337,33,4.4,146,"(4, 5]"
Qwen Wireless Earbuds Bluetooth Headset Touch Control Earphones With Digital Led Display,1000,580,42,3.9,149,"(3, 4]"
VON 1.7L CORDLESS KETTLE VSKL17BNK WHITE AND BLACK (1YR WRTY),2395,1410,41,4.4,190,"(4, 5]"
Qwen TWS Wireless Earbuds Headset With Power Bank Black,1500,829,45,0.0,154,
GUIXIA Tws Wireless Bluetooth Headsets Earphones Pro4,826,427,48,3.8,108,"(3, 4]"
Fashion Cream Big Round Mosquito Net-FREE SIZE.,1500,879,41,4.1,164,"(4, 5]"
Knife Sharpeners Kitchen Sharpener  Three  Stages,700,445,36,3.8,143,"(3, 4]"
Oraimo FreePods Lite ENC 40-hour Playtime Havybass True Wireless Earbuds,2508,2100,16,4.5,199,"(4, 5]"
"Maybelline Lifter Gloss Hydrating Lip Gloss With Hyaluronic Acid, Topaz",2000,1279,36,4.6,534,"(4, 5]"
Fashion Men Loafers Shoes Casual Pu Leather Shoes Sneaker Shoes Black,1000,650,35,3.8,239,"(3, 4]"
Geemy Reachable Hair Trimmer/Clipper/Shaving Machine,800,770,4,0.0,257,
Fast Charging 10000mAh Power Charging Bank Black,1150,790,31,3.8,238,"(3, 4]"
"AILYONS TYB-201 Blender & Grinder - 1.5L, 350W. (1YR WRTY)",2699,1699,37,4.2,94,"(4, 5]"
Color Screen Smart Watch Heart Rate Sport Bracelet,990,545,45,3.2,165,"(3, 4]"
Oraimo 10000mAh Power-Bank OPB-P110DN,2432,1620,33,4.1,228,"(4, 5]"
Geemy Electric Hair Trimmer Barbering Machine - Kinyozi,1400,1350,4,3.8,629,"(3, 4]"
"Rashnik 22"" 3 Layer S.S. Dish Rack",0,2040,0,4.2,101,"(4, 5]"
Gene6 2 Pieces  Leather Automatic Buckle Belt - Black And Golden,699,405,42,0.0,37,
"14-43"" Wall Bracket +Free 4 Way Extension",800,650,19,4.1,83,"(4, 5]"
L'Oreal GLYCOLIC BRIGHT INSTANT GLOWING SERUM 15ML,1700,1224,28,4.5,113,"(4, 5]"
AILYONS Quality Dry Iron Box With Titanium Teflon Nonstick Soleplate,1500,1130,25,0.0,279,
RichRipple Phone Tripod 3in1 Wireless Remote Control Selfie Stick With LED Light,699,455,35,4.2,34,"(4, 5]"
Fashion 3-Pack Round-Neck Heavy Duty 160 GSM T-shirts White/Grey/Black,1200,789,34,3.7,20,"(3, 4]"
Sokany Wireless Lavalier Microphone Recording For Type-C,1200,650,46,4.2,53,"(4, 5]"
Fashion Mens Long Sleeve Casual Pattern Floral Business Printed Shirts Official Vintage,1500,890,41,3.8,53,"(3, 4]"
Maybelline Fit Me Hydrating Primer Luminous And Smooth,1475,1394,5,4.6,402,"(4, 5]"
RichRipple Metal Electric Hair Clippers Rechargeable Beard Hair Trimmer Salon Hair Cutting Kit  Vs Limit Comb,999,566,43,4.1,20,"(4, 5]"
Fashion Women Shoes Ladies Shoes Sneakers Women-red,980,599,39,3.1,169,"(3, 4]"
5 By 6 White Mosquito Net With Portable Metallic Stand,1370,1299,5,4.4,14,"(4, 5]"
Fashion Men Shoes Sneakers Sport Shoes Running Sneakers Casual Shoes  Welcome To Smark,998,551,45,3.5,19,"(3, 4]"
Oraimo FreePods Lite ENC 40-hour Playtime Havybass True Wireless Earbuds With APP Control-Black,2500,1899,24,4.5,114,"(4, 5]"
Fashion Women Bags Handbag Shoulder Women Bag  Mini Cross Body Bags Women Handbag,1599,1000,37,0.0,67,
Fashion 10pcs Makeup Brushes Set For Foundation -Black,600,499,17,4.1,404,"(4, 5]"
Fashion Men Shoes Loafers Casual Shoes Male Shoes Slip-On Shoes Business Loafers,1547,799,48,0.0,88,
Vitron VB-815 - 2in1 Blender - 1.5L - 350W - White & Blue,3050,1710,44,0.0,230,
Maybelline New York Superstay Skin Tint Shade  77 With Vitamin C,2500,2000,20,4.7,26,"(4, 5]"
Fashion 4 PCS Women Bags Ladies Bags Handbags Purse Shoulder Bags Tote Bags Hobo Bags,1798,827,54,3.3,106,"(3, 4]"
Maybelline New York Superstay Skin Tint Shade  67 With Vitamin C,2500,2000,20,4.5,30,"(4, 5]"
Sundabest Classy juice/ water Glass Jug (11891),0,366,0,4.5,21,"(4, 5]"
Ceriotti Super GEK 3000 Blow Dry Hair Dryer - Black.,1830,1829,1,0.0,804,
Sports Wireless Bluetooth Earphone Neck Hanging Headset,475,265,44,3.4,56,"(3, 4]"
Oraimo Traveller 4 20000mAh 2.1A Triple Ports Fast Charging Power Bank- Black 1YR WRTY,3500,2299,34,4.3,94,"(4, 5]"
NIVEA MEN Deep Body Lotion For Men - 400ml (Pack Of 2),1340,1005,25,4.7,524,"(4, 5]"
Fashion 2024 Mens Casual Sci-Fi Warrior Shoes Running Sneakers - Black/Green,21282614,1490,43,0.0,140,
AILYONS 1000W Electric Dry Iron Box Plus Free 4-Way Extension,1500,1274,15,0.0,164,
Smart Collection Invictus Men Perfume 48Hrs Last,325,299,8,4.3,57,"(4, 5]"
Foldable Electric Dry Iron 50ml Water Tank Portable Travel Steam Iron Box,1710,950,44,4.1,26,"(4, 5]"
Fashion 3PACK Pure Cotton Brief Boxers Men's Underwear,0,900,0,3.9,1445,"(3, 4]"
In-Ear Wireless Touch Bluetooth Earphones Sport Headsets With Noise Reduction,1102,595,46,3.7,29,"(3, 4]"
Big Pink Round Mosquito Net For Single Bed-FREE SIZE..,1500,879,41,0.0,177,
MK Electronics TV Guard Surge Protector With High Quality Power Extension,1100,999,9,0.0,219,
Fashion Women Sneakers Ladies Shoes Women,835,551,34,3.1,27,"(3, 4]"
Fashion Men's Elegant Office Flat PU Leather Loafer  Oxfords Casual Rubber Shoes White,2173,1380,36,3.6,96,"(3, 4]"
"Genera Hand-Held Electric Whisk Milk, Coffee Frother Mixer Fruit Stick-White",588,293,50,3.9,68,"(3, 4]"
Power King 6 Way Extension Cable + Free 5 Way Extension,630,590,6,4.1,248,"(4, 5]"
120-In-1 Screwdriver Set Precision Screwdriver Repair Kit,1782,896,50,4.6,48,"(4, 5]"
Fashion Sneakers Women Shoes Women's Shoes Ladies,9601045,540,48,3.4,244,"(3, 4]"
"Haier HMW20MB Analog Microwave Oven 700W, 20L - Black",10395,8499,18,4.6,23,"(4, 5]"
Selfie Rechargeable Phone Selfie Super Bright Light Bulb Ring For Makeup/Vlog,700,368,47,3.8,67,"(3, 4]"
Fashion Men Fabric Adjustable Canvas Belt -Tactical Belts,500,245299,51,4.2,134,"(4, 5]"
5 By 8 Soft Fluffy Patches Carpets Non-slip Rugs Floor Mat,4000,2599,35,0.0,86,
"Home Design 14""-55"" ROTATING And TILT Wall Bracket",899,880,2,3.9,115,"(3, 4]"
"Titan Gel Natural Oil Essential For Penis Enlargement,",2600,1399,46,3.6,25,"(3, 4]"
4Pcs Set Of Stainless Aluminum Sufuria WITH Lids,2000,1499,25,3.6,12,"(3, 4]"
HP USB Flash Drive - 64GB Silver,1209,771,36,4.1,35,"(4, 5]"
Professional Electric Hot Comb Straightener,2009,1499,25,0.0,59,
Fashion Men's Fashion Casual Sneakers - Black,17492245,1190,47,3.8,72,"(3, 4]"
Intelligent Digital Bathroom Weigh Scale Body Fat Scale,1627,949,42,4.5,51,"(4, 5]"
RichRipple 3-Cables Portable Power Bank 20000mAh Fast Charger,1837,1599,13,4.3,39,"(4, 5]"
RichRipple T900 Ultra 2 Smart Watch Band Bluetooth Call Smart Watches,1929,1115,42,3.7,57,"(3, 4]"
Fashion 2024 Mens British High Boots Running Sneakers - Black,23043000,1590,47,3.8,127,"(3, 4]"
Fashion Women Sneakers Shoes Ladies Sneakers Women Shoe,940,699,26,3.6,69,"(3, 4]"
Men's Chest Bags Waterproof Casual Waist Bags Short Trip Travel Carry Bag,712,439,38,3.5,50,"(3, 4]"
Yixin 3 PCS/Sets Tshirt T-shirt Men Wear Men Suit Men Coat Short Sleeve,1799,1299,28,0.0,35,
Maybelline Fit Me Mattifying Primer Matte And Poreless,1475,1254,15,4.5,515,"(4, 5]"
Fashion Versatile Sneakers Men's Board Shoes-whtie,1900,1499,21,3.6,8,"(3, 4]"
Maybelline New York Superstay Skin  Tint Shade 66 With Vitamin C,2500,2000,20,4.5,29,"(4, 5]"
Fashion All-match Men's Canvas Slip-on Peas Shoes,1299,699,46,3.3,23,"(3, 4]"
Qwen Makeup Sponges Beauty Blender Sponge Pink 4pcs /Set,500,299,40,4.6,199,"(4, 5]"
10kg Digital Kitchen Scale Cooking Weighing Scale,800,520,35,4.1,169,"(4, 5]"
Garnier Micellar Cleansing Jelly Water With Charcoal,925,602,35,4.5,218,"(4, 5]"
2 Pcs Belt Elastic Non-marking Braided No-punch Woven Versatile Balck Coffee,329,248,25,3.3,27,"(3, 4]"
Fashion Mens Long Sleeve Shirts Casual Trendy Sweatshirts Sport-Blue,1000,626,37,3.9,225,"(3, 4]"
Qwen 64GB USB Flash Drive Portable Flash Disks Metal,1000,750,25,4.2,157,"(4, 5]"
Fashion Men Dress Shirt Long Sleeve Business Formal Regular Fit Office Shirt White,1000,699,30,3.4,18,"(3, 4]"
Fashion 2024 New Men's Outdoor Casual Trendy Sports Shoes - Black,22042882,1499,48,3.4,54,"(3, 4]"
"NIVEA Perfect & Radiant Luminous630 Anti Dark Marks Serum, 30ml & Day Cream, 40ml",5610,3299,41,4.4,432,"(4, 5]"
Fashion 4PCs Most Beautiful Printed Seamless Panties(Hips 38-44inches),0,1000,0,4.4,716,"(4, 5]"
NIVEA MEN Black & White Original Anti-Perspirant Rollon - 50ml (Pack Of 2),1040,728,30,4.7,237,"(4, 5]"
Fashion Women Shoes For Women Shoes Ladies,940,649,31,3.2,33,"(3, 4]"
Fashion 6 PCS Men Underwear Underpants Pants Briefs Knickers 6 In 1,1099,551,50,0.0,1,
Derma Roller Face Micro Needle Anti-aging Anti-wrinkle 0.5mm,770,370,52,4.1,67,"(4, 5]"
Men's Chest Bags Waterproof Casual Waist Bags Short Trip Travel Carry Bag,710,406,43,3.6,73,"(3, 4]"
Fashion Business And Leisure Retro British Soft Leather Sneakers Men's Shoes,1880,1290,31,3.7,15,"(3, 4]"
Samsung 15W Galaxy TYPE C FAST Charger,1500,799,47,0.0,21,
Samsung 64GB Metal USB Flash Disk Pen Drives Samsung,1500,754,50,3.9,85,"(3, 4]"
Wrist Watch For Men Luminous Analog Quartz Luxury Fashion Watch - Gold,1029,538,48,3.3,65,"(3, 4]"
Fashion Mens Leather Shoes Men's Official Leather Shoes Mens Leather Shoes Black,1309,799,39,3.3,49,"(3, 4]"
Derma Roller Micro Needling Anti Wrinkle CE Approved 0.5 Mm,500,394,21,4.3,117,"(4, 5]"
Sundabest 6 Piece decorated Tea/cofee Cups (5830),0,330,0,4.5,17,"(4, 5]"
AILYONS Quality Dry Iron Box With Titanium Teflon Non-stick Soleplate,1200,1120,7,4.1,108,"(4, 5]"
Bluetooth 5.1 Wireless Headphones Bluetooth Earphones 50Hrs Playtime Wireless Earbuds,1095,626,43,3.7,26,"(3, 4]"
Fashion Electric Hair Straightener Brush Straightener Comb,1500,850,43,0.0,78,
Phelistar Digital TV Aerial Antenna,750,700,7,3.9,169,"(3, 4]"
Beard Oil Moustache & Body Hair Fast Growth Oil - NEW,599,380,37,3.7,37,"(3, 4]"
Fashion Men's Formal Casual Shoes - Brown,20802529,1290,49,0.0,122,
GUIXIA  Pro3 In-ear Wireless Bluetooth Headsets Headphones I13,754,459,39,3.6,78,"(3, 4]"
"Phelistar Antenna Aerial & 14"" - 43"" Mount For Digital TV",990,950,4,3.7,186,"(3, 4]"
RichRipple P9 Bluetooth Headsets Hi-Fi Stereo Noise Reduction Headphone,1377,699,49,3.8,37,"(3, 4]"
TWS Bluetooth Earbuds Heavy Bass Fingerprint Touch Control,1000,550,45,0.0,44,
Fashion Men's Formal Casual Peplum Shoes - White,17491983,1190,40,0.0,80,
Fashion 4 PCS Women Bags Ladies Bags Handbags Purse Shoulder Bags Tote Bags,1598,781,51,3.9,235,"(3, 4]"
Fashion Men Pants Trousers Overalls Cargo Pants Men Clothes,1214,735,39,3.2,75,"(3, 4]"
"Stand, Laptop Holder Riser Computer Stand, Adjustable Aluminum Foldable Portable Notebook Stand",900,535,41,4.6,297,"(4, 5]"
Fashion Men's Trendy Zipper Comfort Hoodie Varsity Sport Coat Jacket Sweatshirts - White,1384,753,46,0.0,218,
Digital Blood Pressure Monitor Machine Health Vascular Heartbeat Test,3167,1710,46,3.9,24,"(3, 4]"
Fashion 3 PCS Women Bags Ladies Bags Handbags Purse Shoulder Bags Hobo Bags Tote Bags,2199,1103,50,4.6,9,"(4, 5]"
Fashion 3 PCS Women Bags Ladies Bags Handbags Purse Shoulder Bags Tote Bags Hobo Bags,2468,1299,47,3.6,476,"(3, 4]"
L'Oreal Glycolic Bright Glowing Cream Day SPF25 50ml,1800,1294,28,4.4,87,"(4, 5]"
Dark And Lovely Waterless Cleanser - 250ml,595,417,30,4.5,575,"(4, 5]"
Fashion Men'S Button Shirt  Men Casual Print Shirt  Long Sleeved Shirts.,1500,8991099,40,3.7,16,"(3, 4]"
"Oraimo Deeper Bass, HD Sound Earphone + Mic",398,378,5,4.5,750,"(4, 5]"
Maybelline Superstay Matte Ink Liquid Lipstick - 20 Pioneer,2400,1530,36,4.5,828,"(4, 5]"
Fashion Mens Lightweight Winter Varsity Jackets Business Comfort Casual Zipper Sport - White,1851,992,46,3.8,76,"(3, 4]"
