Product Name,Old Price,New Price,Discount,Rating,Ratings Count,Rating Range
Macaroon Bluetooth Wireless Earphones Headsets Gift-Black  TWS Black,914,529,42,4.2,19,"(4, 5]"
Fashion Men's  Elegant Shoes Office Flat Leather Loafer Breathable Casual White,3600,1780,51,4.3,6,"(4, 5]"
Fashion Men Short Sleeve Polo Shirt,1551,790,49,4.7,28,"(4, 5]"
Dove Pampering Body Wash/Shower Gel + Gentle Scrub + Exfoliating Gloves,1680,1675,1,4.8,12,"(4, 5]"
Sun King Pico Plus Pack Of 2 SolarLight,2520,2394,5,4.4,49,"(4, 5]"
Maybelline Fit Me Powder 365 Espresso,1420,1348,5,4.5,165,"(4, 5]"
RichRipple Wired Wood Desktop Speakers Bass Stereo Subwoofer Sound Box Computer Speakers,1561,979,37,4.1,24,"(4, 5]"
UNCOVER Aloe Invisible Sunscreen,0,2999,0,4.4,34,"(4, 5]"
Adult Travelling Neck Pillow- Black,900,664,26,4.1,97,"(4, 5]"
"Rashnik Bullet Thermos, 750ml",0,540,0,3.6,32,"(3, 4]"
Fashion 4in1 Panties For Ladies Comfortable Fit Underwear,1199,799899,33,2.3,3,"(2, 3]"
Fashion Butt Lifter Shapewear Underwear Briefs Hips Lifting Shaping Panties Sexy Shaper,806,596,26,3.5,25,"(3, 4]"
Hair Clipper Hair Trimmer Electric Shaver USB Cordless,1399,719,49,4.2,44,"(4, 5]"
Fashion 2024 Suede Mid-ankle Comfy Shoe Sneakers - Black,1063,570,46,3.8,8,"(3, 4]"
Fashion Men's Hawaiian Ink Print  Bottom-down Beach Short Sleeve T-Shirt Casual Tops,1000,850,15,4.3,11,"(4, 5]"
Rashnik Rn-1020 400w Mixer/ Blender With Grinder (Red),0,2016,0,3.3,4,"(3, 4]"
Rashnik 1000W Single Cooking Plate Stove Electric Ring Hot Plate Cooker,715,714,1,0.0,21,
TC All-In-1 Shoe Rack/Coat Rack/Cap Scarf Bag Cloths Hanger- Black,3300,1897,43,3.7,34,"(3, 4]"
D-ildo Pants Suspenders L-esbian Pantie Sex Games,2664,1685,37,4.3,20,"(4, 5]"
Fashion Women's Office Floral Print Sleeve Long Grown Casual Dresses Party,1286,900,30,3.5,146,"(3, 4]"
Fashion Shoes Laides Sneakers Women Shoes Sports Shoes,666,551,17,3.5,119,"(3, 4]"
Fashion Men Black Pocket Casual Pants Cargo Pants Harem Joggers,1380,820,41,0.0,0,
Fashion Women Shoes Sneakers Shoes Ladies,734799,549,31,3.5,21,"(3, 4]"
"Home Design ROTATING And TILTING TV Wall Bracket For 14""-55""",1050,950,10,4.1,39,"(4, 5]"
Samsung ORIGINAL 25 W Fast Type C Charger 25W USB C Adapter,1400,799,43,3.9,8,"(3, 4]"
Smart Collection Burberry Weekend Women Perfume,399,320,20,4.2,34,"(4, 5]"
TV Guard OR FRIDGE Guard 13AMPS,1400,719720,49,4.2,12,"(4, 5]"
Fashion 4 PCS Women Bags Ladies Bags Handbags Purse Shoulder Bags Tote Bags Hobo Bags,1798,827,54,3.5,34,"(3, 4]"
Fashion Women Shoes Sneakers Sport Shoes Casual Shoes Running Sneakers,1755,999,43,4.2,154,"(4, 5]"
Wireless BT5.1 Neckband Headsets Earphones Support TF Card,1069,620,42,4.2,42,"(4, 5]"
Fashion 2Piece Set Men's Short Sleeve T-Shirt & Trousers,15001568,860900,45,3.4,11,"(3, 4]"
Fashion Men's Casual Synthetic Leather Shoes,1399,899999,36,0.0,1,
Fashion 3 PCS Women Bags Ladies Bags Handbags Purse Shoulder Bags Tote Bags Hobo Bags,2059,1195,42,3.4,40,"(3, 4]"
Wireless Lavalier Microphone For Phone(Type-C&iPhone),1846,1286,30,4.3,58,"(4, 5]"
SIWAR BY Néo Artisanal  High-top Military Desert Combat Leather Boot ,4000,2850,29,4.7,6,"(4, 5]"
Mara Activated Charcoal 250g,500,450,10,4.7,63,"(4, 5]"
Fashion Mens Casual Leather Half Loafers & Slip-ons Slippers Open Shoes Sandals Blue,2757,1520,45,3.8,11,"(3, 4]"
Rashnik Rashnik RN-337 Vegetable ROUND GRATER,480,479,1,4.4,5,"(4, 5]"
Mekis Jamaican Black Castor + Amla + Rosemary + Peppermint Oil–Promotes Hair Growth & Stops Hair Fall,8601180,620940,28,4.1,50,"(4, 5]"
Fashion Wigs Hair Wigs Women Wigs,1899,999,47,3.8,21,"(3, 4]"
NIVEA UV Face Shine Control Cream SPF 50 – 50ml Pack of 2,2600,2080,20,4.6,109,"(4, 5]"
Yixin (2 Pieces)Men's Summer Casual Fashion Loose Shorts,1599,999,38,3.9,10,"(3, 4]"
Mountain Wolf Unframed Canvas Painting Living Room Wall Picture Poster Decor,275,150,45,0.0,4,
Fashion 3Pack Finest Men's Long Sleeve Checked Shirt Slim Fit,3000,23993000,20,3.7,22,"(3, 4]"
Fashion Men Casual Shoes Walking Shoes Outdoor Shoes Loafer Shoes,1000,599,40,3.6,11,"(3, 4]"
Fashion Casual Shoulder Sports Sling Chest Bag Crossbody Bag - Gray,799,495,38,3.5,24,"(3, 4]"
Green Leaf Cockroach Killer Pest Powder Sachets,1851350,93761,50,0.0,38,
Fashion Men's Cargo Pants-beige,13991949,13491499,23,4.1,118,"(4, 5]"
Fashion Black Cotton Kneelength Ribbed Bodycon Dress Longsleeve,900,699,22,3.7,49,"(3, 4]"
Fashion 3 Pieces Of Adjustable Baseball Cap - Multicolour,0,699,0,4.3,388,"(4, 5]"
Efero Exfoliating Foot Mask Pedicure Foot Peeling Mask_,550,266,52,4.5,98,"(4, 5]"
"Aris Technique Eau de Parfum Spray, EDP Intense Men's Perfumes,Cologne for Men.",2600,1489,43,4.4,9,"(4, 5]"
Veet 5 In 1 Hair Removal Cream For Sensitive Skin- 100g,1000,690,31,4.9,14,"(4, 5]"
Fashion Summer Men Short Sleeve Shirt Breathable Casual Printing Shirts,912,734,20,3.5,19,"(3, 4]"
Fashion SAWA Leisure Shoulder Sports Suspender Chest Bag Crossbody Bag With USB Interface - Black,969,495,49,3.2,19,"(3, 4]"
Fashion Men Printed T-shirt Slim Fit,1135,690,39,3.1,66,"(3, 4]"
Mara Indigo Powder 100g,0,1200,0,4.4,87,"(4, 5]"
Automatic Water Dispenser-smart Wireless Pumping Unit,570,550,4,4.1,69,"(4, 5]"
"SADOER Aromatherapy Lavender, Rosemary, Chamomile Essential Oils",500,284,43,0.0,27,
Fashion Khaki Cargo Pants+Socks,2000,1569,22,4.2,111,"(4, 5]"
Fashion 2 In 1 Ladies Handbags Set Women Shoulder Bags Tote Bag Crossbody Bag,2021,1199,41,3.7,302,"(3, 4]"
C Pregnancy Pillow,2899,2279,21,3.9,19,"(3, 4]"
Makeup Sponges Beauty Blender Sponge Pink 4pcs /Set,414,265,36,4.8,36,"(4, 5]"
Fashion Mens Colorful Stitching Turtle Neck Polos Shirts Short Sleeve T-shirt,965,671,30,3.6,36,"(3, 4]"
"Multiple Power AAA 1.2V 1250mAh Rechargeable Battery, Re-charged For Up To 1000 Times",910,530,42,4.7,9,"(4, 5]"
Samsung Super Fast Dual Car Charger Adapter 45W + 15W Two Port Pd With USB Type C to Type Cable,0,998,0,4.5,13,"(4, 5]"
Wireless Keyboard & Mouse Combo FOR PC & Smart TV,2000,1250,38,4.4,34,"(4, 5]"
Cerave Daily Moisturizing Lotion With Hyaluronic Acid - 236ml,0,1499,0,3.3,18,"(3, 4]"
VIC Phone Vlog Video Fill Light Kit With Adjustable Tripod Mic,3989,2970,26,3.8,5,"(3, 4]"
Vaseline Lotion Cocoa Glow Void 100ml,0,175,0,4.5,13,"(4, 5]"
Fashion 4 PCS Women Bags Ladies Bags Handbags Purse Shoulder Bags Tote Bags,1598,781,51,3.8,131,"(3, 4]"
Fashion Men's 2 In 1 Short Sleeve T-Shirt & Shorts Set- White,1471,888,40,3.9,34,"(3, 4]"
"SADOER Niacinamide Face Brightening Essence, whitening and Moisturizing Essence",590,333,44,4.2,24,"(4, 5]"
4 In 1 Men Shaver Hair Clipper Trimmer Rechargeable Razor,1586,999,37,3.5,40,"(3, 4]"
Fashion 2 In 1 Tracksuits Mens Suits Track Suit Sportswear,2703,1800,33,3.9,162,"(3, 4]"
Alloy High Precision Kitchen Food Weighing Scale -10kg 1g,3475,1860,46,4.4,70,"(4, 5]"
Fashion Sexiest Quality Velvet Zipped Neck Stretchy Bodycon Dress,1200,11491197,4,4.4,25,"(4, 5]"
Electric Toothbrushes With 4 Brush Heads - Black,1590,990,38,3.9,26,"(3, 4]"
MK Electronics TV Guard + 4 Way Socket Extension + FREE 1.5M HDMI,1200,1050,13,4.3,52,"(4, 5]"
Oraimo Fast Charging Type C USB Cable,0,320,0,4.6,74,"(4, 5]"
"Multi-pocket Leggings Overalls For Men, Casual Trousers - Black",1360,682685,50,2.3,4,"(2, 3]"
"Vision Plus 3 In 1 Cable, 1M - Black",500,380,24,0.0,5,
Digital Scale Kitchen Gram Weighs 1 Gram to 10 Kilos Maximum Capacity 10 Kg,900,509,43,0.0,2,
Mouse Pad Relieve Stress Comfy EVA Wrist Support-Black,293,195,33,4.9,18,"(4, 5]"
Bluetooth Wireless Mouse Silent Office Rechargeable Mouse,926,476,49,4.4,63,"(4, 5]"
Oraimo PowerBox 300 Lite 30000mAh 15W Power Bank,8400,4200,50,4.3,8,"(4, 5]"
Fashion Men's Oxfords Formal Flat Business Leather Shoes Black,2660,1290,52,0.0,3,
Fashion Luxury Cubic Zirconia Inlaid Women Engagement Wedding Party Ring Jewelry Gift,265,145,45,3.6,74,"(3, 4]"
RichRipple 8 Ultra Smart Watch Bands Gift Box Smart Watches,3675,2599,29,4.1,29,"(4, 5]"
Fashion Women Love Heart Design Bracelet Bangle Jewelry Chain-Black,86,60,30,3.6,18,"(3, 4]"
Oraimo Pure Bass-Earphones- Free Rubber Buds,0,399,0,4.3,298,"(4, 5]"
Fashion Women Rhinestone Star Moon Bead Charm Chain-Pink,133,88,34,4.4,13,"(4, 5]"
Velvex Baking Paper 38cm X 10m,295,207,30,4.5,22,"(4, 5]"
NIVEA Perfect & Radiant Day & Night Essentials Pack For Normal Skin,0,3610,0,4.5,41,"(4, 5]"
HDMI Cable 10M,1900,963,49,4.6,63,"(4, 5]"
Nova Hair Shaving Machine And Beard Trimmer (Rechargeable),1000,600,40,4.6,8,"(4, 5]"
Vision Plus Stereo Earphones (Extra Comfort) - Black,299,190,36,4.8,4,"(4, 5]"
Fashion 2PCS Summer High-end Antibacterial Polo Shirt Pure Cotton  Lapel Black And White,1976,1185,40,3.7,26,"(3, 4]"
100pcs soft Cotton Rounds For Makeup Removal pads Skincare wipes,800,423,47,0.0,0,
ON OFFER Luxurious Comfy Warm Woolen Duvet Size: 5*6 Does not have a bedsheet or pillowcases,3500,2199,37,0.0,2,
Maybelline Fit Me Matte And Poreless Foundation 30 Ml 356 WARM COCONUT,0,1790,0,4.3,844,"(4, 5]"
Binnys Finest Quality 2 In 1 Strappless Bridal Bras,5991000,549739,41,4.5,78,"(4, 5]"
150Kgs Digital Platform Weighing Scale,10000,5999,40,4.8,13,"(4, 5]"
Fashion Ladies Sneakers Breathable-White,2883,1426,51,4.3,3,"(4, 5]"
Fashion Ankle-Length Trousers Sportswear Boys Joggers Summer Men Pants Tie Feet Overalls,872,799,8,3.4,23,"(3, 4]"
Men‘s Shirts Printed T-shirt Slim Fit,1260,756,40,3.1,8,"(3, 4]"
Beard Oil Beard Growth Oil Fast Beard Growth Oil_Hair Growth,500,333,34,4.1,8,"(4, 5]"
Fashion Men's Belt Leather Automatic Buckle Belts,1120,571,49,0.0,1,
"Maybelline Lifter Gloss Hydrating Lip Gloss With Hyaluronic Acid, Pearl",2000,1388,31,4.7,88,"(4, 5]"
"Sokany 3 In 1 Sandwich, Waffle Maker & Grill",3500,3232,8,4.2,51,"(4, 5]"
Ors Wrap/Set Mousse,800,599,25,4.3,19,"(4, 5]"
SADOER Rosemary Essential Oil Aromatherapy Essential Oil,500,284,43,4.7,7,"(4, 5]"
"Depilatory Paper,100 Sheet Hair Removal Wax Paper Strips ,Disposable Professional Hair Removal Tool Non-woven Waxing Strips,7.9’’ x 2.8’’",500,499,1,4.6,7,"(4, 5]"
Fashion 3 PCS Women Bags Ladies Bags Handbags Purse Shoulder Bags Hobo Bags Tote Bags,2199,1199,45,3.7,35,"(3, 4]"
Fashion  3 In 1 Ladies Handbags PU Leather Tote Bags Women Shoulder Bag,1500,999,33,3.3,7,"(3, 4]"
NIVEA Strawberry Shine Lip Balm For Women - 4.8g (Pack Of 2),870,609,30,4.5,133,"(4, 5]"
Fashion Adjustable Canvas Belt No Metal Anti-allergy Belt,0,400,0,4.1,38,"(4, 5]"
"Fashion 6PCS NET SEAMLESS COTTON UNDERWEAR, LADIES PANTS",1000,986,1,3.8,12,"(3, 4]"
95cm Artificial Green Plant Hanging Vine Bracketplant Home Garden Decoration,696,382,45,2.5,4,"(2, 3]"
Fashion 6PCs EXTRA Cotton Long Lasting Checked Men Boxers,13992000,11871297,37,3.4,29,"(3, 4]"
Silicone Women's Cli_t G Spot Vaginal Vibrator Dildo Sex Toy (Pink),1999,1399,30,4.1,20,"(4, 5]"
Sundabest 6 Pcs Tea Cup Set (17866),1028,1027,1,3.8,9,"(3, 4]"
Blackhead Remover Kit Steel Black Head Acne  Extractor 4pcs,300,189,37,4.6,44,"(4, 5]"
MK Electronics TV Guard With FREE 4 Way Power King Extension,870,850,2,4.2,40,"(4, 5]"
Derma Roller Beard Growth 0.5mm Derma Roller System+ Free  Gift Aichun Beard Growth Essential Oil,1000,759,24,0.0,51,
Fashion Mens Casual Trousers Jean Official Jogger Sports - Black,1254,909,28,4.1,73,"(4, 5]"
EDENBERG EB-3608-A 4PCS Kitchen Utensils Set - Grey,0,720,0,4.3,4,"(4, 5]"
USN Hyperbolic Mass Straw -1Kg (2.2 Lbs),0,1999,0,4.2,315,"(4, 5]"
Fashion Adult Sex Toy Dildo,2199,1199,45,4.3,3,"(4, 5]"
Fashion Cowboy Baseball Cap Embroidered Letter Cap Spring Casual Sun Hat,826,519,37,3.8,15,"(3, 4]"
NIVEA MEN Cool Kick Body Lotion For Men - 400ml (Pack Of 2),1340,1005,25,4.7,149,"(4, 5]"
Chris Adams Lets Imagine Perfume,2000,1879,6,4.5,51,"(4, 5]"
Black Hair Headband,380,250,34,0.0,1,
"Bioaoua Salicylic Acid, Acne Removal Cleanser, Shrink Pores",695,333,52,4.3,21,"(4, 5]"
Anti-slip Bathroom Mat Antislip Non Slip Safety Mat.,1200,740,38,4.3,20,"(4, 5]"
Finest Official Trouser Pant -Navy Blue-Slim Fit Office Wear Men,12001500,9981399,33,4.1,7,"(4, 5]"
Fashion Thermal Steamer Hair Heat Cap Hair Steamer Cap Deep Conditioning Best Hair Heat Cap,1200,849,29,4.6,112,"(4, 5]"
"General Electric DCQ Q6 Dual Card, FM, Flashlight, 800MAH – Black",1301,1200,8,3.4,26,"(3, 4]"
1.8M HDMI To VGA Cable,1500,757,50,3.3,3,"(3, 4]"
L'Oreal Glycolic Bright - Serum + Day Cream Routine Kit,4100,3075,25,4.1,7,"(4, 5]"
Dvee Organics UV Face Sunscreen,1500,950,37,4.3,20,"(4, 5]"
"Mekis Rosemary Clove Hair Oil - Encourage new hair follicle growth, Strengthens strands, Reducing thinning and promoting volume.",524,360,31,0.0,0,
Itel Rechargeable Smart Trimmer,1400,980,30,0.0,4,
Oraimo USB TYPE C TO TYPE C FAST CHARGING CABLE,430,398,7,4.4,92,"(4, 5]"
Geisha Moringa Oil Soap 225G,0,155,0,4.7,23,"(4, 5]"
Fashion Summer Mens Loose Vintage Short Sleeve Hawaii Beach Shirts  - Rainbow,1317,717,46,3.6,29,"(3, 4]"
Airplane Cup Big Ass Pussy Butt Reversal Model Famous Sex Toy For Men - Brown,1869,1320,29,3.8,9,"(3, 4]"
Sundabest Classy High Quality Black Dinner Plates 6 Pcs (311009123),0,1290,0,0.0,2,
Fashion 8Pcs Finger Rings Vintage Electroplating Finger Rings Golden,231,154,33,0.0,3,
Fashion Women Sneakers Ladies Shoes Women Shoe,977,639,35,3.6,31,"(3, 4]"
iMatchme Ashwagandha capsules,2700,1500,44,4.6,5,"(4, 5]"
C15 Super//Strong Bass USB Rechargeable C15 BT Speaker/ Robot TF/AUX + 2 Gifts,3000,1959,35,0.0,4,
Fashion 4Pcs Men's Underwear Breathable Comfortable Stretch Cotton Boxer Briefs,1200,720,40,3.9,16,"(3, 4]"
"MK Fridge Guard With Free TV Guard,,free Extension",1850,1380,25,4.8,5,"(4, 5]"
Fashion Mens Pants Casual Fashion Skinny Elastic Waist Harem Jogging Running Trousers,1382,1102,20,3.8,25,"(3, 4]"
Fashion Hoodies Plain Black Unisex,1500,899,40,3.4,106,"(3, 4]"
Fashion Men's Fashion Trendy Board Shoes - White,17302056,1090,47,3.7,3,"(3, 4]"
Maybelline SuperStay 30H Active Wear Foundation- 79 WARM CHESTNUT,2400,1680,30,4.5,70,"(4, 5]"
1 Pc Lemon Squeezer + 1 Pc Free Garlic Crusher,1200,640,47,4.6,13,"(4, 5]"
"Automatic Toothpaste Dispenser, Toothbrush Holder",1800,980,46,3.3,17,"(3, 4]"
4pcs Men's Underwear Boxer Brief Breathable,2071,1256,39,0.0,62,
Fashion Mens Sneakers Shoes Outdoor Hiking Shoes Non-slip Sports Shoes Breathable Blue,1408,718,49,4.2,9,"(4, 5]"
Fashion Men Shoes Sneakers Skateboarding Shoes Sport Shoes Running Sneakers Casual Shoes,1790,1059,41,3.8,155,"(3, 4]"
Fashion Mens Casual Bomber Business Lightweight Jackets Blazers Trench Coats,1654,937,43,3.5,20,"(3, 4]"
U Pregnancy Pillow,3899,2469,37,4.4,34,"(4, 5]"
Beard Oil Nourish For Soft Strong Beard And Mustache Growth - 30ml,599,333,44,0.0,10,
Shoes Rack Closet Storage Assembly Rack Clothes Organizer 6-layer,1738,1011,42,3.5,40,"(3, 4]"
"SADOER Skin Rejuvenating Alpha Arbutin Serum, Moisturizer",500,284,43,3.5,11,"(3, 4]"
NIVEA Rich Nourishing Body Lotion 100ml,180,175,3,0.0,6,
Ard Alzaafran Mousuf Perfume,2400,1679,30,4.8,12,"(4, 5]"
Fashion 1 Pair Women Fashion Elegant Ear Stud Hollow Square Jewelry-,137,84,39,4.2,11,"(4, 5]"
LASA Posture Corrector Clavicle Fracture Back Shoulder Correction Brace,950,585,38,3.5,4,"(3, 4]"
NIVEA 5 In 1 Complete Care Nourishing Cocoa Body Lotion With Cocoa Butter & Vitamin E – 200ML,360,288,20,4.5,59,"(4, 5]"
Fashion Women's Luxurious Fine Diamond Pearl Hollow Hoop Heart  Earrings Set 9 Pair,709,359,49,4.7,18,"(4, 5]"
Qwen Bluetooth Earphones Wirelss HeadsetsFinger Touch with Power Bank,800,499,38,4.2,20,"(4, 5]"
Fashion Men's Shoes Color Breathable Outdoor Fish Scale Running Shoes,1274,8901199,30,3.5,17,"(3, 4]"
Fashion Hard Khaki Trouser Pants - Grey,1299,960,26,3.8,6,"(3, 4]"
Men Soccer Shoes AG High Ankle Football Boots Men Sneakers-Black,4104,2093,49,3.8,18,"(3, 4]"
"SADOER 2 in 1, Turmeric Serum + Turmeric Soap Bar for Pore Shrinking, Anti Acne, Moisturizing Tumeric Combo",1110,569,49,3.9,7,"(3, 4]"
"Mekis Sodium Bentonite Clay –For Oily,Blackheads & Acne Prone Skin",419605,220530,47,4.4,30,"(4, 5]"
Garnier Micellar Oil-Infused Cleansing Water (Oil In Water) - 400ml,990,949,4,4.6,752,"(4, 5]"
Fashion 2 Piece Set Men's T-Shirt & Shorts - Black,1553,1057,32,3.7,23,"(3, 4]"
Miniso Aromatic Scent Diffuser,0,359,0,4.1,80,"(4, 5]"
"Fashion 2 Pairs Exfoliating Gloves For Scrub, Multicolours",500,250,50,4.5,6,"(4, 5]"
Stainless Steel Stock Pot Set With Lid Cookware Stew Pot-5Pcs,3733,2240,40,3.3,4,"(3, 4]"
Riapawel 4 PCS Bohemian Beaded Bracelets,399,298,25,4.1,15,"(4, 5]"
Samsung 25 W Fast Type C Charger 25W USB C Adapter,1300,808,38,4.4,7,"(4, 5]"
Fashion Classic Streetwear Casual Pants Men Jogging Pants Male Slim Fit Cargo Pants Multi-Pockets Trousers,1052,872,17,3.3,19,"(3, 4]"
Adidas Runfalcon 3.0 Men Running Shoes,9152,4576,50,4.1,7,"(4, 5]"
Fashion Teenager Men's Sneakers Sports Running Shoes,2500,15901790,36,0.0,38,
Sokany Non Stick Bread Toaster Pop Up Sandwich Maker Machine,3500,1990,43,2.8,4,"(2, 3]"
Fashion Popular Personality New Simple Multi Layered Lotus Pendant Necklace Neckchain,399,349,13,3.5,17,"(3, 4]"
64GB Phone 10 SD Memory Driving Recorder TF Card,1312,665,49,3.8,98,"(3, 4]"
"EDENBERG 20cm EB-3381 Die-casting Crepe Pan Marble, Black",1260,1197,5,3.7,15,"(3, 4]"
Fashion Classic Ladies Anti Blue Cat Eye Glasses,872,486,44,4.6,40,"(4, 5]"
Fashion 4D Shock Absorption Orthopedic Sports Insoles Soft Breathable High-elastic Running Shoe Pad Latex,1769,891,50,3.8,8,"(3, 4]"
"Wireless Keyboard Mouse For TV Box Laptop, Desktop",2200,1243,44,3.6,17,"(3, 4]"
Fashion Men Bags PU Chest Bags with USB Crossbody Bags Shoulder Bags Sling Satchel Messenger Bags,800,620,23,3.6,12,"(3, 4]"
Digital TV Aerial Plus 10mtr Cable+Free Clips,1300,759,42,0.0,0,
"Wall Mounting Bracket14-43""+FreeTv Guard+Extension",1500,1200,20,4.1,21,"(4, 5]"
Adidas Vultrun M Men Running Shoes,12800,4168,67,4.8,15,"(4, 5]"
Tisa Nyota Ladies Handbags PU Leather Bucket Bags Women Tote Bags 3 In 1,1500,1150,23,4.3,14,"(4, 5]"
Beard Oil 100% Natural Beard Growth & Moustache Growth Oil.,1300,585,55,0.0,0,
Metal Afro Comb/Pick Comb,300399,299350,12,4.1,16,"(4, 5]"
7200MaH Rechargeable Fan USB Folding Telescopic 7.7 Inch,3105,1710,45,4.2,30,"(4, 5]"
Faux Leather Wallet For Men - Grey/Brown,836,450,46,4.2,33,"(4, 5]"
Fashion 4PCS Cotton Tummy Control Highwaist Seamless Panties,995,833,16,4.1,197,"(4, 5]"
Axe Body Spray for Men - Dark Temptation - 150ml,0,499,0,4.6,19,"(4, 5]"
"Ethernet LAN Network Internet Cable - 1.5M 3M, 5M, 10M",450900,299799,38,4.2,19,"(4, 5]"
Fashion Ladies Dresses Dress Women Dresses High Elastic Skirts Short Dresses,1371,699,49,3.8,25,"(3, 4]"
Nunix Room Heater With A Fan With Automatic Temperature Control,3999,2398,40,4.7,3,"(4, 5]"
"VON VAMS-20MGX - Manual Microwave Oven, Solo - 20L - Black.",11995,8899,26,4.6,120,"(4, 5]"
NIVEA Black & White Clear Anti-Perspirant Rollon 48h - 50ml (Pack Of 2),1040,728,30,4.5,102,"(4, 5]"
Fashion 4 PCS Women Bags Ladies Bags Handbags Purse Shoulder Bags Tote Bags Hobo Bags,1798,827,54,3.5,75,"(3, 4]"
Guasha Tool Heart-Shaped Prevent Wrinkle Green-Dark  Green,459,292,36,4.8,44,"(4, 5]"
"Beard Oil Beard Oil, Moustache & Body Hair Fast Growth Oil",499,335,33,3.8,57,"(3, 4]"
Fashion Men's Casual Leather Shoes,2200,1290,41,4.1,24,"(4, 5]"
Fashion Men's Casual Striped Polo Vintage Long Sleeve T-Shirt - Multicolore,1300,750,42,3.6,32,"(3, 4]"
Fashion Soft Khaki Trouser Stretch Slim Fit Casual,12991800,12681299,28,4.1,236,"(4, 5]"
Electric Automatic Penis Pump Powerful USB Rechargeable Penis Enlarger Vacuum Pump,3841,2380,38,4.3,15,"(4, 5]"
Fashion Women Bags  Backpacks Ladies Bags Handbags School Bags Satchel Purse,1339,625,53,3.5,18,"(3, 4]"
"Power King 4 Way Extension Cable, 13A, 3m Long Cable -Recommended",831,499,40,4.7,19,"(4, 5]"
Fashion 4 PCS Women Bags Backpacks Ladies Bags Handbags School Bags Purse Tote Bags,1440,899,38,3.1,97,"(3, 4]"
Fashion 6pcs Lace Ladies Seamless Panties- Booty Transformation,2000,1199,40,4.2,76,"(4, 5]"
"UTP CAT 6 Patch Cord 1.5M, 3M, 5M, 10M, 20M",4802700,2991399,48,4.6,62,"(4, 5]"
Fashion Checked Soft Cotton Boxers - Assorted (6 Pack)+free Gift,989,699,29,3.7,42,"(3, 4]"
Fashion Mens T-shirt Turtle Neck Sweatshirt Casual Long Sleeve Shirts-White,1009,625,38,0.0,22,
LASA USB 3.0 To Type-c OTG,895,450,50,4.2,5,"(4, 5]"
Fashion Ladies Luxurious Elegant Love Button Necklace,369,249,33,2.7,3,"(2, 3]"
3 Bottle combo Pack Motivational Water Bottle with Straw Time Marker-multicolour,1300,1250,4,3.2,5,"(3, 4]"
Fashion Men Glossy Casual Brogue Official Leather Shoes Oxford Loafers & Slip-Ons Golden,5999,2540,58,0.0,2,
Fashion Jeans Designer Baseball Face Cap Hat- Blue Berets,1384,742,46,4.9,7,"(4, 5]"
Hisense Dual Air Fryer 6.3 Liters (2YRs WRTY),15000,9899,34,4.3,18,"(4, 5]"
Fashion Classic Ladies Anti Blue Light Cat Eye Glasses,899,499,44,0.0,1,
Fashion Women Diamond Jewelry Pearl Triangle Ball Heart-shaped Stud Earrings Set-12Pairs,529,280,47,4.1,95,"(4, 5]"
Maybelline Sky High Lash Sensational Mascara - Black,0,2300,0,4.6,184,"(4, 5]"
Fashion 2024 Men Casual Air-Cushion Running Sneakers,871,449,48,3.8,6,"(3, 4]"
"Fashion 14"" Brazilian Curly Headband Wig +Free Gift Inside!",2500,18991998,24,4.2,45,"(4, 5]"
Fashion Mens Long Sleeve Casual Pattern Vintage Floral Polo Business Official T-Shirts,1200,650,46,0.0,3,
Fashion 2 PCS/Sets T-shirts Tshirts Shorts For Men Clothes,1250,788,37,3.7,14,"(3, 4]"
Mara Ayurvedic Shampoo Bar- 100g,400,350,13,4.6,27,"(4, 5]"
"Mekis Nail & Cuticle Oil-25ml,For White Spots,Lines &Damaged Nails",640,380,41,4.6,34,"(4, 5]"
"Angelique Massage And Aromatherapy Oil-Enriched With Strawberry,300ml",700,352,50,4.3,4,"(4, 5]"
Maybelline Superstay Matte Ink Lipstick 50 Voyager,2400,1658,31,4.4,1004,"(4, 5]"
Fashion 2 PCS Women Bags Ladies Bags Handbags Purse Shoulder Bags Tote Bags,1559,849,46,0.0,70,
Fashion Couple Heart Necklace,399,249,38,3.5,20,"(3, 4]"
"Nunix 20L Electric Rotisserie Oven, 1280W",5152,5151,1,0.0,41,
Fashion Men Women Alloy Tai Chi Ying Yang Pattern Faux Leather-,187,124,34,3.6,19,"(3, 4]"
RichRipple 7 Ultra Smart Watch Bands Gift Box Smart Watches,3675,2199,40,4.5,18,"(4, 5]"
UNCOVER Essential Skincare Kit,6848,5794,15,4.6,36,"(4, 5]"
Oraimo CHARGE & SYNC CABLE FOR IPhone,0,330,0,4.6,54,"(4, 5]"
Bosch Germany Brand Granite Cooking Pots Heavy Duty Cooking Pots,18000,9486,47,3.8,10,"(3, 4]"
Fashion Mens Cotton Jacket Autumn And Winter Windbreak Blazers,2300,1420,38,3.4,24,"(3, 4]"
Power King 3x 4 Way Power Extension Cable + Free Gift,1100,1050,5,4.1,147,"(4, 5]"
Fashion 3 Pcs Men's Polos Short Sleeve T-Shirt - Multicolor,4760,2380,50,0.0,0,
Simple Hydrating Light Moisturiser - 125ml,0,1250,0,4.6,39,"(4, 5]"
Phelistar Digital TV Aerial - Multicolor,750,700,7,0.0,142,
Ard Alzaafran Mousuf Perfume ,2000,1590,21,4.1,8,"(4, 5]"
L'Oréal Paris Revitalift Pure 0.2% Retinol Face Serum 30ML,2900,2175,25,4.8,32,"(4, 5]"
Skilltech 15-55 Inch Tilting TV Wall Mount Bracket.,850,820,4,4.4,191,"(4, 5]"
1.8M DISPLAY PORT DP TO HDMI CABLE,1600,814,49,3.8,5,"(3, 4]"
Fashion Women Shoes Sandals Heels Slippers Ladies Shoes Casual Shoes,1899,999,47,4.1,26,"(4, 5]"
Fashion Sexy Lingerie Babydoll Erotic Lace Babydoll Pajamas Nightdress,699,499,29,4.6,34,"(4, 5]"
Fashion New Men's Shiny Leather Pointed Toe Work Shoes,1900,1090,43,0.0,1,
4you Automatic Water Heater Electric Kettle Plus Free Iron Box,2500,2090,16,4.6,5,"(4, 5]"
Fashion Queen Letter Pendant Clavicle Necklace - Silver,275,179,35,3.8,24,"(3, 4]"
Bio-Oil Bio-Oil Bio-oil - 200ml,1655,1654,1,4.5,10,"(4, 5]"
VON VSCP60MMX Pressure Cooker 1000W - 6L,14495,10999,24,4.7,226,"(4, 5]"
HIGH QUALITY STONE PAN,1990,1269,36,4.9,16,"(4, 5]"
Geemy Rechargeable Cordless Shaving Machine With Indicator,2500,1705,32,4.3,12,"(4, 5]"
3 Male Rubber Delay Ejaculation Sex Toy Penis Cock Ring,999,569,43,4.2,19,"(4, 5]"
Laundry Basket Toy Organizer,1500,785,48,4.4,13,"(4, 5]"
Power King Extension Plus &Fridge &Tv Guard White///SUPERFLY,2000,1380,31,0.0,39,
1 Pc High Quality Velvet Woolen Duvet Blanket- Nice Feeling And Comfort,2389,2385,1,0.0,0,
TY13 4K High Gain HDTV Digital Antenna Mini HDTV Ground Wave TV Antenna,1310,705,46,3.5,6,"(3, 4]"
Fashion Official Trouser Pant -Black-Slim Fit Office Wear Men,1500,999,33,0.0,2,
"Maybelline Lifter Gloss Hydrating Lip Gloss With Hyaluronic Acid, Stone",2000,1248,38,4.7,101,"(4, 5]"
Fashion Women Multilayer Faux Pearl Rhinestone Pendant Choker Chain-,229,153,33,3.5,41,"(3, 4]"
Fashion Long Sleeved Floral Men's Slim Fit Shirt,24683074,13501550,50,4.3,9,"(4, 5]"
L'Oréal Paris Revitalift Anti-Wrinkle Serum + Laser Retinol Serum,5900,3835,35,4.6,31,"(4, 5]"
Soft Brown Patches Carpet Size: 5*8,7999,2399,70,4.3,4,"(4, 5]"
Phelistar Outdoor Digital TV Aerial Antenna + 3 FREE GIFTS,850,800,6,3.6,8,"(3, 4]"
Fashion 5 Pack Soft Khaki For Men-Multicolour,53497999,52495499,34,4.4,52,"(4, 5]"
Dvee Organics Dark Spots Corrector Cream,1300,950,27,3.8,8,"(3, 4]"
Fashion 1pcs Knitted Beaines Skullies Beanies Bonnet-Black,1315,734,44,3.9,26,"(3, 4]"
Fashion Mens Sneakers Outside Sport Shoes Walking Shoes Beige,1500,899999,40,0.0,3,
Fashion 2 In 1 Men's Short Sleeve Shorts Set - White,15291700,850,50,3.7,47,"(3, 4]"
Vaseline Lotion Dry Skin Void 100ml,0,175,0,4.5,6,"(4, 5]"
"Maybelline Lifter Gloss Hydrating Lip Gloss With Hyaluronic Acid, Ice",0,2000,0,4.7,205,"(4, 5]"
Maybelline Superstay Vinyl  Ink 55 Royal,2795,1799,36,4.7,109,"(4, 5]"
"Fashion 4pcs Family Pack Tongue Scrapers Cleaners Brushes 100% BPA Free Tongue Scraper For Adults & Kids, Healthy Oral Care, Easy To Use, Help Fight Bad Breath",1600,781,51,4.2,26,"(4, 5]"
Fashion 3PCs Super Comfy Cotton Men's Brief Boxers,6921000,692739,30,4.3,56,"(4, 5]"
Rashnik Instant heater shower head,1620,1619,1,3.8,16,"(3, 4]"
9.5L Stainless Steel Portable Water Catering Coffee/Tea Urn,4000,2760,31,4.4,32,"(4, 5]"
Wahl Professional Balding Hair Cut Kinyozi Machine Shaver + FREE Gown,6000,3099,48,0.0,1,
Fashion Wigs Hair Wigs Women Wigs,1466,899,39,3.1,48,"(3, 4]"
Fast Charging Data Cable For IPhone - IPad - IPod,450,245,46,4.5,38,"(4, 5]"
Ecoa Char Plus,5490,4000,27,4.8,6,"(4, 5]"
"Fashion Sexiest Black Mock Neck Stretchy Bodycon Dress (Hips 34-42"" Fit)",650,573,12,4.1,362,"(4, 5]"
"Danny Home Sevdikler Tall Glasses, Set Of 6 (1988-8)",0,960,0,0.0,2,
