Product Name,Old Price,New Price,Discount,Rating,Ratings Count,Rating Range
Power King 3 × 4 Way Power Extension Cable & GIFTS,2300,1599,30,0.0,9,
Fashion Kinky Straight Headband Wig,3000,1995,34,4.2,18,"(4, 5]"
HDMI Cable 3M,880,427,52,4.4,59,"(4, 5]"
12 Litre Black Insulated Lunch Box,1990,1350,32,2.3,4,"(2, 3]"
PORTABLE shue rack for 10 pairs -blue,1799,899,50,0.0,2,
Round Anti-slip Bathroom Mat Antislip Non Slip Safety Mat,1200,740,38,4.4,70,"(4, 5]"
Derma Roller 0.5mm 1.5mm DERMAROLLER MICRO NEEDLE BEARD HAIR SKIN FACE WRINKLE & ANTI-AGING DERMA,10452090,8501045,50,4.5,11,"(4, 5]"
Bluetooth Wireless Mouse Silent Office Rechargeable Mouse,926,476,49,4.4,63,"(4, 5]"
"Fashion Ladies Fashion Printed Small Square Bag,Chain Bag,Messenger Handbag - Black",906,662,27,0.0,3,
Miniso Aromatic Scent Diffuser,0,359,0,4.1,80,"(4, 5]"
Garnier Micellar Oil-Infused Cleansing Water (Oil In Water) - 400ml,990,949,4,4.6,753,"(4, 5]"
Fashion 2 In 1 Men's Polos Shirts Cotton Short Sleeved T-shirt,1822,1094,40,3.8,27,"(3, 4]"
Fashion Pure Leather Double Sided Belt.2 In 1,2500,1900,24,4.3,158,"(4, 5]"
Fashion Official Trouser Pant -Black-Slim Fit Office Wear Men,1500,999,33,0.0,2,
Fashion Women Grown Elegant Floral Print V-neck Dress Ladies Clothes,1435,850,41,3.7,75,"(3, 4]"
Fashion Jeans Designer Baseball Face Cap Hat- Blue Berets,1384,742,46,4.9,7,"(4, 5]"
Dvee Organics UV Face Sunscreen,1500,1000,33,4.3,20,"(4, 5]"
Vaseline Lotion Cocoa Glow Void 100ml,0,175,0,4.5,13,"(4, 5]"
NIVEA Perfect & Radiant Day & Night Essentials Pack For Normal Skin,0,3610,0,4.5,42,"(4, 5]"
Fashion 4 PCS Women Bags Backpacks Ladies Bags Handbags School Bags Purse Tote Bags,1440,899,38,3.1,97,"(3, 4]"
Fashion 36 Pairs Set Gold Earrings Fashion Ear Studs Unisex Jewelry,1280,640,50,4.3,27,"(4, 5]"
Old Spice Captain Deodorant Stick 48hrs Dry- 50ml,1600,950,41,4.4,7,"(4, 5]"
Fashion Men's Casual Oxfords Pu Leather Loafers Brogues Shoes Wedding White,1600,1280,20,3.7,6,"(3, 4]"
Oraimo Fast Charging Type C USB Cable,0,320,0,4.6,74,"(4, 5]"
"Fashion 14"" Brazilian Curly Headband Wig +Free Gift Inside!",2500,18991998,24,4.2,45,"(4, 5]"
Fashion 3 Pieces Of Adjustable Baseball Cap - Multicolour,699,664,5,4.3,388,"(4, 5]"
Fashion Men's Cargo Pants-beige,13991949,13491499,23,4.1,119,"(4, 5]"
SADOER Vitamin C Brightening Face Cream Moisturizer 50g,500,350,30,3.5,19,"(3, 4]"
GREY CURTAIN For Curtain,15005900,11805699,26,3.7,10,"(3, 4]"
tretinoin Acnesol Acne Cream 25g,1000,599,40,4.7,3,"(4, 5]"
Laundry Basket Toy Organizer,1500,785,48,4.4,13,"(4, 5]"
Men Breathable Outdoor Walking Men's Sneaker Comfortable PU Leather,2196,1120,49,4.2,11,"(4, 5]"
Fashion 3 Pcs Hard Khaki Men's Trouser Black/chocolate/beige,29993800,29993199,16,4.1,146,"(4, 5]"
Fashion Classic Ladies Anti Blue Cat Eye Glasses,872,486,44,4.6,42,"(4, 5]"
Easily Portable & Foldable Steam Iron Box - White And Blue,2000,1180,41,4.1,8,"(4, 5]"
Fashion Men's Fashion Sneakers High Top Board Shoes,26673118,1390,55,4.1,44,"(4, 5]"
Lingke Men's Electric Shaver Hair Trimmer USB Rechargeable,1000,850,15,4.4,31,"(4, 5]"
Fashion 2024 Men Casual Air-Cushion Running Sneakers,871,449,48,3.7,7,"(3, 4]"
Samsung 25 W Fast Type C Charger 25W USB C Adapter,1300,850,35,4.4,7,"(4, 5]"
"Bioaoua Salicylic Acid, Acne Removal Cleanser, Shrink Pores",695,350,50,4.4,22,"(4, 5]"
Multiple Power AA Rechargeable Battery Plus Charger,1500,1179,21,4.8,5,"(4, 5]"
Fashion 4 PCS Women Bags Ladies Bags Handbags Purse Shoulder Bags Tote Bags Hobo Bags,1798,899,50,3.5,34,"(3, 4]"
4pcs/set Kojic Acid Soap Body Skin Lightening Soap,1500,890,41,4.1,17,"(4, 5]"
Fashion Men's Casual Striped Polo Vintage Long Sleeve T-Shirt - Multicolore,1300,750,42,3.6,33,"(3, 4]"
Adidas Runfalcon 3.0 Men Running Shoes,9152,4576,50,4.1,7,"(4, 5]"
150Kgs Digital Platform Weighing Scale,10000,5999,40,4.8,13,"(4, 5]"
Adidas Runfalcon 3.0 Men Running Shoes,9152,4576,50,4.8,15,"(4, 5]"
Dove Pampering Body Wash/Shower Gel + Gentle Scrub + Exfoliating Gloves,1680,1675,1,4.8,13,"(4, 5]"
Beard Oil Fast Beard Growth Oil For Moustache & Facial Hair,599,380,37,0.0,1,
Fk 5000W Smart High Power Professional Hair Blow Dryer,1500,1449,3,3.7,55,"(3, 4]"
Maybelline Fit Me Matte And Poreless Foundation- Mocha 360,0,1790,0,4.3,687,"(4, 5]"
Maybelline Fit Me Matte And Poreless Foundation 30 Ml 356 WARM COCONUT,0,1790,0,4.3,844,"(4, 5]"
Samsung ORIGINAL 25 W Fast Type C Charger 25W USB C Adapter,1400,799,43,3.9,8,"(3, 4]"
Samsung ORIGINAL 25 W Fast Type C Charger 25W USB C Adapter,1400,799,43,3.9,8,"(3, 4]"
Fashion SAWA Leisure Shoulder Sports Suspender Chest Bag Crossbody Bag With USB Interface - Black,969,495,49,3.2,19,"(3, 4]"
Derma Roller  0.5mm 1.5mm DERMAROLLER MICRO NEEDLE BEARD HAIR SKIN FACE WRINKLE & ANTI-AGING DERMA,1500,845949,44,3.5,2,"(3, 4]"
Finest Official Trouser Pant -Navy Blue-Slim Fit Office Wear Men,12001500,9981399,33,4.1,7,"(4, 5]"
Sundabest Classy High Quality Black Dinner Plates 6 Pcs (311009123),0,1290,0,4.5,4,"(4, 5]"
HDMI Cable 1.5M,400,299,25,4.4,51,"(4, 5]"
Men‘s Shirts Printed T-shirt Slim Fit,1260,756,40,3.1,8,"(3, 4]"
"Mekis Sodium Bentonite Clay –For Oily,Blackheads & Acne Prone Skin",419605,220530,47,4.5,32,"(4, 5]"
2M 3.5mm Male To Male Jack Aux Cable,0,198,0,4.7,50,"(4, 5]"
Meinaier Coffee Sea Salt Bath Whitening SPA Scrub -680g,7001200,420699,42,4.3,84,"(4, 5]"
C15 Super//Strong Bass USB Rechargeable C15 BT Speaker/ Robot TF/AUX + 2 Gifts,3000,1959,35,4.2,5,"(4, 5]"
Tongue Scraper 100% BPA Free Effective Tongue Brush Tool Bad Breath Treatment Food Grade PP Tongue Cleaner For Oral Hygiene,500,319,36,4.1,27,"(4, 5]"
Fashion Mens Elastic Side Pocket Cargo Shorts Nicker Sweat  Pants,1200,950,21,4.7,3,"(4, 5]"
NIVEA Strawberry Shine Lip Balm For Women - 4.8g (Pack Of 2),870,609,30,4.5,133,"(4, 5]"
Fashion Women Sneakers Ladies Shoes Women Shoe,977,639,35,3.6,31,"(3, 4]"
Fashion 2 In 1 Women's Sport Shorts Yoga Short Pants Summer Short Pants,856,437,49,4.9,7,"(4, 5]"
Electric Cooker / Single Spiral Coil Hotplate,1900,999,47,3.5,6,"(3, 4]"
3D Fashion Ladies Body Shaper High Waist black,1200,899999,25,0.0,8,
Skin Doctor Aloe Vera Whitening Scrub Face&Body-Dead Skin& Acne Remover,600,399,34,4.2,9,"(4, 5]"
Fashion Sexy Lingerie Babydoll Erotic Lace Babydoll Pajamas Nightdress,699,499,29,4.6,35,"(4, 5]"
Airplane Cup Big Ass Pussy Butt Reversal Model Famous Sex Toy For Men - Brown,1869,1320,29,3.8,9,"(3, 4]"
Fashion 1 Pair Women Fashion Elegant Ear Stud Hollow Square Jewelry-,137,84,39,4.3,12,"(4, 5]"
Geemy Shaving Machine-Kinyozi & 4 Way Extension + 5.0 P47 Headphones,3000,2000,33,4.2,13,"(4, 5]"
MAX MEN Maxman Blue Gel Penis Enlargement Erectile Dysf And Delay,1500,950,37,0.0,3,
Fashion Women Shoes Sneakers Sport Shoes Casual Shoes Running Sneakers,1755,999,43,4.2,154,"(4, 5]"
Hub USB HUB 3 0 Adapter 4 Port USB 3.0 High Speed-Gray,900,490,46,4.8,16,"(4, 5]"
Maybelline Sky High Lash Sensational Mascara - Black,0,2300,0,4.6,184,"(4, 5]"
Fashion Women Canvas  Shoes Low Top Lace-up Shoes Classic Casual Sneakers,1500,799959,47,4.6,7,"(4, 5]"
Oraimo Fast Charging Type C USB Cable,350,249,29,4.7,3,"(4, 5]"
"Home Design ROTATING And TILTING TV Wall Bracket For 14""-55""",1050,950,10,4.1,39,"(4, 5]"
4 In 1 Men Shaver Hair Clipper Trimmer Rechargeable Razor,1586,999,37,3.5,40,"(3, 4]"
SADOER Salicylic Acid Acne Treatment Essence_30ml,798,399,50,4.1,34,"(4, 5]"
Fashion Sex Toys For Women-Adult,2199,1399,36,0.0,4,
Nova Hair Shaving Machine And Beard Trimmer (Rechargeable),1000,600,40,4.6,8,"(4, 5]"
Itel Rechargeable Smart Trimmer,1400,980,30,0.0,4,
Oraimo Micro USB Data Cable 2M For V8 Charger,200,150,25,4.7,12,"(4, 5]"
"Angelique Massage And Aromatherapy Oil-Enriched With Strawberry,300ml",700,370,47,4.3,4,"(4, 5]"
Reusable Condom Penis Delay Sleeve Extender,1000,699,30,3.5,4,"(3, 4]"
Men Soccer Shoes AG High Ankle Football Boots Men Sneakers-Black,4104,2093,49,3.8,18,"(3, 4]"
Geisha Moringa Oil Soap 225G,155,125,19,4.7,26,"(4, 5]"
Dr. Rashel Vitamin C Essense Toner+Face Serum+Face Cream,1950,1302,33,4.3,3,"(4, 5]"
Fashion 3PCs Sexy Silky Strap With A Golden Ring Sparkle Thong Panties,900,699,22,4.9,8,"(4, 5]"
Axe Body Spray for Men - Dark Temptation - 150ml,550,500,9,4.6,19,"(4, 5]"
Fashion Eyelash Curlers Lash Natural Curler Makeup Tools-Black,300,219,27,4.3,274,"(4, 5]"
PH METER + TDS EC TEMP METER -Water Quality Tester,0,5250,0,0.0,2,
"Fashion 2pcs Men's Short Sleeve T-Shirt+Shorts, Youth Casual Sports Suit, Homewear-Black",2480,18801890,24,0.0,0,
Male Penis Extender Pump Penis Extender Sex Toy,1899,999,47,3.4,5,"(3, 4]"
Oraimo CHARGE & SYNC CABLE FOR IPhone,0,330,0,4.6,54,"(4, 5]"
Wired Optical Mouse,450,380,16,0.0,0,
Fashion 6PCs Men's Official Socks - Assorted,1000,840,16,0.0,2,
"Barbers Empty Hair Spray Bottle, Hairstyling,Misting",0,599,0,0.0,1,
SADOER 2 PCs Ginger Hair Growth And Anti-Hair Loss Serums,2000,599,70,0.0,3,
Oraimo FreePods3 True Wireless Stereo Earbuds - Black,4583,2610,43,4.7,3,"(4, 5]"
Vitron 43 Smart Remote,2500,1250,50,4.7,3,"(4, 5]"
Portable Travel Makeup Organizer Cosmetic Bag Multi-Compart,1400,790,44,4.6,8,"(4, 5]"
3 In 1 Trimmer，Hair Beard And Nose Electric Rechargeable Shaver/Trimmer,2680,1563,42,4.1,39,"(4, 5]"
Fashion 5PCs Classy Comfort Freesize Men Ankle Socks,350,239,32,4.3,129,"(4, 5]"
VEGER Slim Ports Portable Charger- 25000mAh Power Bank.,3500,2299,34,4.2,652,"(4, 5]"
Apple Lightning To 3.5 Mm Headphone Jack Adapter For IPhone Aux Audio Cable Adapter,1500,999,33,0.0,1,
Garnier Even & Matte Vitamin C Protection Cream SPF30 50ml,1250,910,27,4.2,1694,"(4, 5]"
Mini Power Bank 8000 MAh  5V / 2.1A  Cute Unicorn Beautiful Lovely Style,1800,1099,39,0.0,1,
Power King FRIDGE Guard + Free 4 Way Power King Extension,950,900,5,4.2,190,"(4, 5]"
Power King Extension Cable - 6 Way,650,550,15,4.2,305,"(4, 5]"
4 Bed Pillows - White 600grams,2300,1614,30,4.5,6,"(4, 5]"
Portable Laptop Riser Stand Foldable Desktop Laptop Holder With 8 Levels Height,1503,780,48,4.2,68,"(4, 5]"
Dr. Rashel Hyaluronic Acid Essence Cleansing Mousse,1200,720,40,4.6,9,"(4, 5]"
"Fashion Kenya Maasai, Maroon T-shirt",1500,1300,13,4.5,4,"(4, 5]"
Foot Mask Exfoliating Foot Mask Pedicure Foot Peeling Mask_,400,350,13,4.6,10,"(4, 5]"
"Mekis Rosehip Seed ,Argan ,Sweet Almond & Vitamin E Oil-Anti-aging, Collagen Production",798,770,4,4.3,8,"(4, 5]"
Classy Unique Good Morning Toothpaste And Toothbrush Holder,2000,1550,23,0.0,1,
Samsung 15W Galaxy TYPE C FAST Charger,1500,799,47,0.0,23,
Nillkin Phone Case For Case/cover Super Frosted Shield For Samsung Galaxy S21,0,1999,0,0.0,1,
Binnys Finest Quality 2 In 1 Strappless Bridal Bras,5991000,549739,41,4.5,78,"(4, 5]"
Samsung Black HD Television Remote Control,1999,1737,13,0.0,1,
Sony Cr2032 Cell 3V Lithium Battery 5pcs Cr 2032 Cmos Batteries Car Alarm Key Toy,0,4991345,0,4.7,27,"(4, 5]"
Fashion Men's Breathable Sneakers Lace up Sports Shoes Outdoor anti-slip Shoes Black,1200,899,25,4.7,3,"(4, 5]"
Duvet 1 Pc High Quality Woolen Velvet Blanket,2389,2385,1,4.4,12,"(4, 5]"
3 Male Rubber Delay Ejaculation Sex Toy Penis Cock Ring,999,569,43,0.0,21,
Double Sided Toilet Brush And Holder,1000,590,41,0.0,1,
Fashion 3 PCS Men T-shirts Sets Tshirt Polos Men Tops Men Clothes,1776,1099,38,3.8,30,"(3, 4]"
Wahl Professional Balding Hair Cut Kinyozi Machine Shaver + FREE Gown,6000,3099,48,0.0,1,
Smart Collection Polo sport pocket/travel size perfume for men,0,315,0,4.5,6,"(4, 5]"
Fashion Titanium Men Ring Student Alloy Ring For Women,400,220,45,0.0,20,
Fashion Men's Fashionable White Elegant Shoes Office Flat Leather Loafer Casual Rubber,1990,1150,42,3.5,20,"(3, 4]"
Fashion Face Hair Nose Ear Eyebrow Removal Trimmer Shaver Clipper.,1000,502,50,3.6,68,"(3, 4]"
"Automatic Toothpaste Dispenser, Toothbrush Holder",1800,980,46,3.2,18,"(3, 4]"
Smart Collection Dunhill desire pocket size Long lasting  perfume for men,0,319,0,4.3,3,"(4, 5]"
Desktop Computer Keyboard - Black,800,699,13,0.0,4,
"Mini Wireless Lavalier Microphone, Cell Phone, Camera Audio Microphone - Black",3320,1990,40,4.5,4,"(4, 5]"
Fashion Weightlifting Half-finger Gloves Wristband Breathable Outdoor Cycling Gloves,1482,799,46,4.5,8,"(4, 5]"
Fashion Men Bags PU Chest Bags with USB Crossbody Bags Shoulder Bags Sling Satchel Messenger Bags,800,550,31,3.6,13,"(3, 4]"
Fashion Hard Khaki Trouser Pants - Grey,1299,960,26,3.8,6,"(3, 4]"
Jumia Arts 100pcs Glow In The Dark Stars Wall Stickers Home Decor,1099,699,36,0.0,1,
Freeyond Smartwatch Sports IP67 Running FY Watch F1,2743,1490,46,4.6,29,"(4, 5]"
Fashion Blue Light Blocking Glasses Anti Blue Light Glasses UV Computer Glasses,1082,580,46,4.3,3,"(4, 5]"
C Pregnancy Pillow,2899,1900,34,0.0,20,
Fashion Men Black Pocket Casual Pants Cargo Pants Harem Joggers,1380,820,41,0.0,1,
Men Perfume Body Fragrance Mist EDT,778,419,46,0.0,0,
Fashion Multi-layer Golden Necklaces Jewely Choker Chain Necklace Vintage For Women,350,269,23,3.6,23,"(3, 4]"
Fashion Men's Fashion Trendy Board Shoes - White,17302056,1090,47,3.3,4,"(3, 4]"
Nunix 2 In 1 Blender With Grinding Machine And Durable Motor 1.5L,4800,2460,49,4.2,40,"(4, 5]"
Universal Stents Adjustable Cell Phone Stand &Tablet Holder-(Blue),200,120,40,4.5,277,"(4, 5]"
Fashion Mens Trench Bomber Coats Blazers Varsity Windbreak Lightweight Trendy Jackets  -  White,22972500,1340,46,3.9,49,"(3, 4]"
Fashion 2 Piece Set Men's T-Shirt & Shorts - Black,1553,1057,32,3.7,23,"(3, 4]"
"Power King 4 Way Extension Cable, 13A, 3m Long Cable -Recommended",831,499,40,4.7,19,"(4, 5]"
Maybelline Superstay Matte Ink Lipstick 50 Voyager,2400,1658,31,4.4,1005,"(4, 5]"
"Vision Plus 3 In 1 Cable, 1M - Black",500,380,24,0.0,7,
Double A Rechargeable Batteries AA 4000mAh 1.2V Ni-MH Battery For Led Light Toy Mp3,10005800,5512935,53,3.7,3,"(3, 4]"
Dhahabu Tea tree Oil 100%,520,299,43,4.3,165,"(4, 5]"
Amar Boric Acid 100g,0,289,0,4.3,11,"(4, 5]"
Fashion Fisherman's Shoes Women's Single Shoes Women's Autumn Flat Shoes,900,450,50,0.0,0,
Adult Travelling Neck Pillow- Black,900,699,22,4.1,100,"(4, 5]"
Men Soccer Shoes TF High Ankle Football Boots Men Sneakers-Black,4104,2093,49,4.3,10,"(4, 5]"
TV Guard OR FRIDGE Guard 13AMPS,1400,715,49,4.2,12,"(4, 5]"
Men Bags Backpacks School Bags Laptop Bags Satchel Bookbags,1999,1099,45,3.8,117,"(3, 4]"
"Fashion 6PCS NET SEAMLESS COTTON UNDERWEAR, LADIES PANTS",1000,986,1,3.8,12,"(3, 4]"
NIVEA MEN Cool Kick Shower Gel For Men - 500ml,1040,728,30,4.6,31,"(4, 5]"
Macaroon Bluetooth Wireless Earphones Headsets New Year Gift-PINK   TWS,600,349,42,3.5,11,"(3, 4]"
"Fashion 4pcs Family Pack Tongue Scrapers Cleaners Brushes 100% BPA Free Tongue Scraper For Adults & Kids, Healthy Oral Care, Easy To Use, Help Fight Bad Breath",1600,781,51,4.2,26,"(4, 5]"
Mara Neem Powder 100g,600,450,25,4.6,53,"(4, 5]"
Adidas Tensaur Sport Training Hook And Loop Shoes Kids,6509,3255,50,4.8,31,"(4, 5]"
Round Aluminium Jua Kali Baking Tin,8501800,6501400,24,0.0,2,
Fashion HIPs And Butt BOOSTER Padded Biker Shorts Hips&butt Enlargement Shapewear,2000,1799,10,0.0,0,
Charging Cable For All Android  Phones And Tablets,120,60,50,0.0,15,
Ors Wrap/Set Mousse,0,700,0,4.4,18,"(4, 5]"
Nunix AK-500 Powerful 2 In 1 Blender With Glass Jar - 1.5L,6000,2999,50,3.9,47,"(3, 4]"
Otg Connect Kit Type C OTG Connect Kit USB Cable,199,189,5,4.3,114,"(4, 5]"
Fashion Women Shoulder Handbag Pu Leather Trendy  Lady Tote Bag,800,390,51,3.7,6,"(3, 4]"
L'Oréal professionnel 10 In 1 Multipurpose  Absolut Repair Oil 90ml,3981,3384,15,4.9,39,"(4, 5]"
Metallic Toilet Paper Holder With Shelf Tissue Holder,700,599,14,4.7,3,"(4, 5]"
Fashion Unisex Knitted Beanie  Cap,399,375,6,0.0,0,
"Fashion Men's Cotton Briefs,Boxer Shorts,Breathable Stretch Loose Briefs",714,364,49,4.5,2,"(4, 5]"
Stainless Steel Wheat Cooking Chopsticks Household-Blue,296,161,46,4.7,14,"(4, 5]"
"Fast Charging 3 In 1 Type C, Micro USB, Lightning",999,664,34,4.8,5,"(4, 5]"
Dvee Organics Body Package,2000,1425,29,0.0,2,
Qwen Makeup Sponges Powder Puff Beaty Blender 6 Pcs/set,600,429,29,4.7,105,"(4, 5]"
LASA 8K Certified Ultra High Speed Hdmi Cable - 2M,1000,680,32,4.8,4,"(4, 5]"
Laptop Charger Power Cable,755,450,40,0.0,0,
"Home Design ROTATING And TILTING TV Wall Bracket For 14""-55""",1050,950,10,4.1,39,"(4, 5]"
Fashion Official Slim Fit Shirt Maroon Turkey Style Long Sleeve,11991800,11991335,33,4.2,21,"(4, 5]"
Wireless Keyboard & Mouse Combo FOR PC & Smart TV,2000,1250,38,4.4,34,"(4, 5]"
Garnier Even & Matte Vitamin  C Booster Serum 30ml.,1750,1050,40,4.3,4547,"(4, 5]"
"Satin Smooth 2 In 1 Reversible Bonnets, Sleeping Cap, Satin Bonnet",1500,1330,11,0.0,1,
Fashion Men's Casual Shoes Loafers & Slip-Ons Sneakers,1299,599699,54,0.0,2,
New Men's Backpack Lightweight Fashion Casual Large Capacity Business 15 Inches,2370,1850,22,4.2,5,"(4, 5]"
Fashion Mens Polarized Sunglasses Square Metal Frame,1603,1122,30,4.9,34,"(4, 5]"
"Power King Extension Cable With 6 AC Power Outlets, 13A, And 2 M Long Cable",550,480,13,0.0,733,
Defacto Woman Special Collection Paperbag Denim Trousers - Black,4095,1637,60,4.9,15,"(4, 5]"
L'Oréal professionnel L&rsquo;Or&eacute;al Professionnel - Absolut Repair Golden Mask 250ml.,2239,1903,15,4.9,24,"(4, 5]"
USB Mini LED Flexible Portable Lamp For Laptop/Notebook/PC - Purple,550,399,27,0.0,1,
SQ 1000 - Powerbank Phone- (20000mAH Battery) - Black,5600,4700,16,4.6,7,"(4, 5]"
Multiple Power AA Rechargeable Batteries  Plus Charger,2310,1210,48,0.0,5,
Leather Serviette Holder,1500,1050,30,0.0,2,
Olive Oil hair and scalp oil for all hair types,0,374,0,0.0,5,
Globe 10 Pack - Globe Insulating Electrical Tape,0,499,0,0.0,0,
Fashion Titanium Couple Ring Plated Blue Alloy Men Rings For Women,411,239,42,4.5,13,"(4, 5]"
L'Oréal Paris Revitalift Anti-Wrinkle Serum + Laser Retinol Serum,5900,3835,35,4.6,31,"(4, 5]"
 Type C Multiport Hub 5 in 1 Adapter Dock Convert to HDMI Multi USB Port  Ethernet LAN Port and 100w PD Suitable for MacBook and Laptop,4500,2999,33,0.0,0,
Fashion 5 Official Shirts Colours Long Sleeve,52497500,49995299,33,4.2,98,"(4, 5]"
Ceiling Plastic Hooks Mosquito Net Hanger Wall Holder,0,550,0,4.5,202,"(4, 5]"
Fashion 2PCS Summer High-end Antibacterial Polo Shirt Pure Cotton  Lapel Black And White,1976,1185,40,3.7,26,"(3, 4]"
Maybelline SuperStay 30H Active Wear Foundation- 70 COCOA,2400,1658,31,4.4,91,"(4, 5]"
Hisense Dual Air Fryer 6.3 Liters (2YRs WRTY),15000,10399,31,4.2,21,"(4, 5]"
Sokany Non Stick Bread Toaster Pop Up Sandwich Maker Machine,3500,1990,43,2.8,4,"(2, 3]"
Defacto Man Young Slim Fit Knitted Trousers - Grey,2154,862,60,0.0,5,
1.8M DISPLAY PORT DP TO HDMI CABLE,1600,857,46,0.0,6,
10 Inches Selfie Ring Light With Tripod Stand And Cell Phone Holder For Live Stream/Makeup RINGLIGHT,2900,1899,35,4.3,18,"(4, 5]"
"Luodais Classic Human Hair,Wig And Weave Repair Serum Plus Free Wig,Weave Or Hair Comb",1200,799,33,4.4,10,"(4, 5]"
Vaseline Lotion Dry Skin Void 100ml,0,175,0,4.5,6,"(4, 5]"
Power King 3x 4 Way Power Extension Cable + Free Gift,1100,1050,5,4.1,148,"(4, 5]"
Ear Piercing Machine Ear Nose Navel Piercing Gun shooting gun,990,499,50,0.0,4,
Black Hair Headband,380,250,34,0.0,1,
Toothpick Floss Dental Floss Picks Teeth Whitening Dental Care Kits Cleaning Oral Care Tool,500,280,44,4.5,10,"(4, 5]"
SADOER Lavender Essential Oil 100% Pure Therapeutic Grade - 10ml,500,284,43,4.3,15,"(4, 5]"
"VGA Cable - 1.5M, 3M, 5M,10M",4901700,249854,50,4.5,11,"(4, 5]"
Fashion Hoodies Plain Yellow Unisex,15001700,899,47,3.6,80,"(3, 4]"
Nice One 6PCS 320ML High Quality Classy Whiskey/Wine/Water Glass (ES5004 GLASS CUP),999,799,20,0.0,3,
Wall Mounted Single Layer Soap Dish Holder,599,499,17,0.0,4,
Fashion Men Glossy Casual Brogue Official Leather Shoes Oxford Loafers & Slip-Ons Black,4882,2540,48,3.5,2,"(3, 4]"
Bluetooth Wireless Noise Reduction Headsets,750,441,41,3.4,9,"(3, 4]"
Nordic Modern Style Coffee Book Table Bedside Table Mini,2469,1259,49,4.7,3,"(4, 5]"
100pcs soft Cotton Rounds For Makeup Removal pads Skincare wipes,800,445,44,0.0,0,
Fashion Mens Sneakers Outside Sport Shoes Walking Shoes Beige,1500,899999,40,0.0,3,
SWEET MEMORY Pearl Hairpins Clip Hair Accessories -5pcs/set,500,329,34,4.4,89,"(4, 5]"
Signature 3PCS Lipstick,499700,262549,47,4.4,24,"(4, 5]"
NIVEA Diamond & Argan Shower Cream For Women - 500ml,955,669,30,4.9,45,"(4, 5]"
"Digital TV Ariel//FREE CABLE,FREE CONNECTOR,Free Extension/FREE14-42 Wall Mount",2600,1400,46,0.0,3,
Fashion Men Oxfords Formal Flat Business Leather Shoes Loafers Corporate Official Black,3492,2320,34,4.2,26,"(4, 5]"
Geemy Rechargeable Cordless Shaving Machine With Indicator,2500,1705,32,4.4,13,"(4, 5]"
Guasha Tool Heart-Shaped Prevent Wrinkle Green-Dark  Green,459,292,36,4.8,44,"(4, 5]"
Electric Meridians Relaxing Foot Massager For Neck And Foot,800,590,26,0.0,1,
Fashion 3 PCS Women Bags Ladies Bags Handbags Purse Shoulder Bags Hobo Bags Tote Bags,2199,1199,45,4.3,16,"(4, 5]"
Fashion Women Ribbon Pearl Embellished Shoulder Bag Ladies Handbags Black Crossbody Bag,899,569,37,0.0,17,
Max Wireless Microphone Plus Receiver,5200,2699,48,3.6,8,"(3, 4]"
Nunix Aluminium Pressure Cooker - Explosion Proof - 4 Litres - Silver - Best Quality,5000,2659,47,0.0,1,
Rio Modern Wooden Tv Stand 5ft,12000,9799,18,0.0,1,
Wireless Mouse & Keyboard Combo -White,2800,1327,53,4.3,15,"(4, 5]"
4you Automatic Water Heater Electric Kettle Plus Free Iron Box,2500,2090,16,4.8,8,"(4, 5]"
Fashion Men T-shirt Printed Slim Fit Short Sleeve,976,498,49,4.5,2,"(4, 5]"
Fashion 5 PCS Women Bags Ladies Bags Handbags Purse Shoulder Bags Tote Bags,1841,959,48,3.7,100,"(3, 4]"
Fashion Adjustable Canvas Belt No Metal Anti-allergy Belt,0,400,0,4.2,39,"(4, 5]"
Maybelline Lifter Gloss Twin Pack - Topaz + Crystal,4000,2600,35,4.8,126,"(4, 5]"
Fashion 4 PCS Pure Cotton Panties/Ladies Underwear,0,9891384,0,4.4,24,"(4, 5]"
Fashion Adult Sex Toy Dildo,2199,1199,45,3.2,5,"(3, 4]"
Sokany 6A 120W USB To TYPE-C Charge Fast Cable 200CM,698,370,47,4.2,19,"(4, 5]"
Fashion Long Sleeved Floral Men's Slim Fit Shirt,24683074,13501550,50,4.4,11,"(4, 5]"
Fashion Simple Charm Moon Star Pendant Necklace Choker Club Party Women Jewelry Gift-Golden,143,78,45,3.7,16,"(3, 4]"
General Craft Unisex Anti Blue Light Protective Computer Screen Glasses,634,414,35,4.1,17,"(4, 5]"
Oraimo Pure Bass-Earphones- Free Rubber Buds,399,371,7,4.3,299,"(4, 5]"
"EDENBERG 20cm EB-3381 Die-casting Crepe Pan Marble, Black",1260,1197,5,3.8,16,"(3, 4]"
Power King Extension Cable 5 Way,800,650,19,3.6,12,"(3, 4]"
Fashion Shoulder Women Handbag Pu Leather Trendy 3 In 1 Ladies  Handbags Set,1500,1050,30,0.0,4,
"SADOER 2 Pieces, Face Wash Salicylic Acid Acne Removal Cleanser + Vitamin C Brightening Cleanser, Improves Skin Radiance, Control Oil",1100,550,50,4.1,7,"(4, 5]"
7200MaH Rechargeable Fan USB Folding Telescopic 7.7 Inch,3105,1800,42,4.2,30,"(4, 5]"
Chris Adams Lets Imagine Perfume,2000,1879,6,4.5,51,"(4, 5]"
Fashion Women Bracelet Butterfly Beads Jewelry Bright-Dark Blue,279,208,25,4.8,18,"(4, 5]"
"Table top Artificial Flower , Decor Stones Plus A Vase",1499,999,33,0.0,0,
Bathroom Tooth Paste Dispenser Toothbrush Holder,1745,950,46,3.5,61,"(3, 4]"
Fashion Splicing Ladies Handbag Tote Bag,1399,899,36,0.0,2,
Beard Oil Nourish For Soft Strong Beard And Mustache Growth - 30ml,599,350,42,0.0,10,
Fashion Short-sleeved T-shirt + Shorts (no Necklaces) - White,1353,950,30,3.1,12,"(3, 4]"
L'Oreal Glycolic Bright - Serum + Day Cream Routine Kit,4100,3075,25,4.1,7,"(4, 5]"
High Speed 64GB Phone SD Memory Driving Recorder TF Card,1199,619,48,4.2,110,"(4, 5]"
Fashion Mens T-shirt Turtle Neck Sweatshirt Casual Long Sleeve Shirts-Black,10511098,610650,42,3.3,18,"(3, 4]"
Super Ducha Fame Instant Shower Head - Salty Water,2000,14601500,27,4.1,53,"(4, 5]"
"USB Extension Cable Male To Female Extender 1.5M, 3M, 5M, 10M",4901800,257999,48,4.3,14,"(4, 5]"
"Mekis Rosemary Clove Hair Oil - Encourage new hair follicle growth, Strengthens strands, Reducing thinning and promoting volume.",550,380,31,4.8,16,"(4, 5]"
Fashion Thermal Steamer Hair Heat Cap Hair Steamer Cap Deep Conditioning Best Hair Heat Cap,1200,849,29,4.6,114,"(4, 5]"
Fashion Mens T-shirt Turtle Neck Sweatshirt Casual Long Sleeve Shirts-White,1009,625,38,0.0,22,
Fashion Mens T-shirt Turtle Neck Sweatshirt Casual Long Sleeve Shirts-Blue,913,551,40,3.9,22,"(3, 4]"
Wahl Professional Cordless Rechargeable Hair Clipper/shaving Machine,6000,2799,53,3.9,10,"(3, 4]"
NIVEA Repair & Care Body Lotion For Women - 400ml (Pack Of 2),1340,1236,8,4.8,235,"(4, 5]"
Nose Ear Hair Trimmer Double Head Epilator Blue,1500,990,34,4.3,20,"(4, 5]"
Universal Foam Cleaning Agent,0,599,0,0.0,2,
Fashion 6 Pairs/Set Jewelry Women's Hollow Hoop Pearl Earrings Gold,600,337,44,4.2,81,"(4, 5]"
Fashion Finger Ring Adjustable Korean Style Ring Silver,155,103,34,4.8,12,"(4, 5]"
Rashnik Rn-1205 Stainless Steel 5ltr Kettle,1200,1199,1,4.3,4,"(4, 5]"
Fashion Handbag Beige Underarm Bag Handbag Stylish Commuter Bag Shoulder Bag Silk Scarf Bag Women's Bag Tote Bag For Women A Gift,1200,850,29,0.0,17,
Logitech M185 Wireless Mouse - Plug And Play,1500,950,37,3.8,9,"(3, 4]"
Garnier Micellar Oil-Infused Cleansing Water (Oil In Water) - 100ml,0,545,0,4.3,288,"(4, 5]"
"1.69"" Full Touch Smart Watch Sport Health Bluetooth Call",2990,1690,43,4.5,21,"(4, 5]"
Windsor AVS 60 Amps Voltage Stabilizer AVS60 Heavy Duty Surge Protector,16000,9997,38,0.0,0,
Barksdale Battery 3 Electronic Remote Candles Flameless LED Timer,4999,2998,40,4.9,11,"(4, 5]"
Anti-slip Bathroom Mat Antislip Non Slip Safety Mat,1200,750,38,4.4,24,"(4, 5]"
Remy Marquis Shalis Perfume For Men EDT - 100ml,3000,1699,43,4.5,22,"(4, 5]"
Fashion 3 Pack High Quality Men Boxers,8991200,799899,33,0.0,116,
Ghost Bond Adhesive Wig Bonding Glue & Wig Remover For Lace Wig Bond.,995,895,10,0.0,2,
Apple 20W PD Car Fast Charger With USB C LIGHTNING CABLE For IPHONE 12 13 14 PRO MAX,3000,1800,40,0.0,4,
Garnier Protection 6 In 1 Cotton Fresh Womens Roll-on - 50ml,350,348,1,4.4,595,"(4, 5]"
"SADOER Niacinamide Face Brightening Essence, whitening and Moisturizing Essence",590,350,41,4.1,25,"(4, 5]"
Got2B Water Resistant Spiking Glue 150ml,0,1099,0,0.0,3,
