Product Name,Old Price,New Price,Discount,Rating,Ratings Count,Rating Range
"S6 Electric Toothbrush, IPX7 Waterproof, USB Rechargeable Toothbrush - Green",2060,1250,39,4.2,5,"(4, 5]"
Samsung 45W Pd Charger Adapter With USB Type C To Type C Cable Fast Charging For Samsung Galaxy S22 / S21 / S21 Plus / S21 Ultra / S20 / S20+ / S10 / S10+ / S10e / S9 / S9+ / S8 / S8+ / Note 8 / Note 9 / Note 10 / Note 10 5g,3000,1600,47,0.0,18,
Fashion Multi-layer Golden Necklaces Jewely Choker Chain Necklace Vintage For Women,350,269,23,3.6,23,"(3, 4]"
JK Lactometer For Checking Milk Purity,550,450,18,4.4,20,"(4, 5]"
Fashion Men's High Top Martin Boots Casual Tactical Combat Outdoor Hiking Shoes Khaki,2100,1530,27,3.4,5,"(3, 4]"
Smart Collection Tom Ford Black Orchid-POCKET SIZE perfume for men,0,325,0,3.8,12,"(3, 4]"
Fashion 3PCs Fine Too Pure Cotton Thong Panties Ladies Panty(Hips 39-46inc) L034,900,799,11,4.2,9,"(4, 5]"
Mara Brahmi Powder 100g,800,700,13,4.7,48,"(4, 5]"
Miniso We Bare Bears Hand Cream Set(Strawberry+Avocado+Lemon),0,359,0,0.0,0,
Barber Salon Chair Hydraulic Base Equipment Plastic Ring Gasket TRIM,1788,950,47,0.0,0,
Easily Portable & Foldable Steam Iron Box - White And Blue,2000,1180,41,4.1,8,"(4, 5]"
5 Pairs Makeup Handmade Natural Cross Long False Eyelashes-,268,160,40,0.0,13,
Al Rasasi Chastity Perfume For Men,2000,1499,25,3.9,22,"(3, 4]"
Fashion Photochromic Anti Blue Light Glasses Round Frame,1603,1122,30,4.6,37,"(4, 5]"
Fashion 2024 Mens Casual Shoes Running Sneakers - Beige,2411,1250,48,0.0,2,
Tokyo Expandable 6ft Modern  Tv Stand,14000,9999,29,3.7,13,"(3, 4]"
Fashion Mens Leather Sandals Black,2422,1190,51,2.5,2,"(2, 3]"
Fashion ORIGINAL MEN SILVER CHAIN,1000,479,52,3.5,10,"(3, 4]"
Dvee Organics Glow Up Package,3550,2945,17,3.9,16,"(3, 4]"
Fashion 6PCs Most Adorable Invisible Ladies Socks(Shoe Size 36-41),395,345,13,4.7,10,"(4, 5]"
USB Rechargeable Beard Hair Trimmer Electric Hair Clippers Salon Hair Cutting Kit With Limit Comb,642,489,24,0.0,18,
Maybelline Superstay Vinyl Ink Nude Shock 135 Fearless,2795,1804,35,4.6,29,"(4, 5]"
Fashion 2024 Men's Sports Casual Vintage Turtleneck Polo Long Sleeve Office Shirts,1100,621,44,4.4,5,"(4, 5]"
Rasasi Secret Perfume For Women,2500,1800,28,0.0,11,
"Omron M1 Basic BP Self-Monitoring Machine (With Warranty, Clinically-Validated)",6999,4799,31,4.8,4,"(4, 5]"
Women's Sneakers Running Flats Shoes,1150,599,48,0.0,0,
Fashion Women's Casual Shoes Anti-Slip Waterproof Shoes,1999,1299,35,4.6,5,"(4, 5]"
Ramtons RM/673 - BLENDER+MILL 1.5 LITERS 5 SPEED (1YR WRTY),5850,5400,8,4.8,4,"(4, 5]"
Fashion Men's Hip Hop Titanium Steel Cuban Chain Necklace,490,359,27,3.9,17,"(3, 4]"
Bluetooth Wireless Noise Reduction Headsets,750,441,41,0.0,3,
SADOER Dark Knuckles whitening Serum Dark Knuckles Remover Serum,699,333,52,3.3,4,"(3, 4]"
Fashion Comfort Adjustable Single Silver Tooth Cap Grillz Hip Hop Teeth Grill Mouth Plain Top Party Grills,1200,629,48,2.5,4,"(2, 3]"
Bluetooth Headphones Fingerprint Control Earpôds,901,527,42,3.7,11,"(3, 4]"
NIVEA MEN Black & White Original Anti-Perspirant Spray 48h - 150ml (Pack Of 2).,0,1440,0,4.6,128,"(4, 5]"
Pretty Pal - 15ml - 611 - Nail Polish Gel Set Accessories Tools,800,499,38,0.0,1,
Foldable Automatic Installation Yurt Mosquito Net.,2239,1999,11,4.4,21,"(4, 5]"
Dr. Rashel Vitamin C Brightening And Anti-aging Face Cream + Face Serum,1200,950,21,4.3,35,"(4, 5]"
Freeyond Smartwatch Sports IP68 Running FY Watch S1,4312,2290,47,4.3,28,"(4, 5]"
Fashion Mens Formal Shoes Breathable Slip On Leather Shoes Black,2222,1390,37,3.5,13,"(3, 4]"
Non Woven Storage Bag For Clothes/duvets,19002000,10441049,48,0.0,4,
Fashion Gorgeous Cotton Sparkly Maxi Dera Dress(Size8/10/12),1100,689,37,4.1,59,"(4, 5]"
Mizani 25 Miracle Milk Leave-In  Conditioner 400ML,0,6635,0,0.0,13,
Fashion 1 Pair Women's Colorful Rhinestone Bowknot Bow Ear Studs-,142,84,41,3.8,19,"(3, 4]"
Fashion Stylish Pocketed Hardhead Jeans - Blue,14991800,1499,17,3.9,172,"(3, 4]"
Fashion 6PCs Men's Official Socks - Assorted,1000,840,16,0.0,2,
Fashion Mens Trench Bomber Coats Blazers Varsity Windbreak Lightweight Trendy Jackets  -  White,22972500,1340,46,3.9,49,"(3, 4]"
Adidas Adilette Aqua Slides Unisex,4600,2199,52,4.4,28,"(4, 5]"
Green Leaf Cockroach Killer Pest Powder Sachets,1801500,100850,49,4.7,11,"(4, 5]"
Miniso Sweet Girl Perfume,0,529,0,4.7,7,"(4, 5]"
Bathroom Tooth Paste Dispenser Toothbrush Holder,1800,1080,40,0.0,6,
Fashion Feng Shui Pixiu Obsidian Stone Wealth Bracelet Ring Set,655,397,39,3.7,46,"(3, 4]"
10-inch Wireless Bluetooth Keyboard Portable Precision Keyboard,1688,958,43,0.0,2,
Ceiling Plastic Hooks Mosquito Net Hanger Wall Holder,0,550,0,4.5,202,"(4, 5]"
Adjustable Fridge / Washing Machine TrolleyStand,2300,1795,22,3.3,4,"(3, 4]"
Fashion Diamond Inlaid Long Tassel Earrings And Studs,412,210,49,0.0,8,
Fashion Women Shoes Sneakers Sport Shoes Running Sneakers Casual Sneakers,2399,1289,46,0.0,1,
Fashion Hard Khaki Trouser Pants  - Green,1299,960,26,0.0,4,
"1,2,3 Seater Fabric Living Room Sofa Cover, Elastic High Chair Cover, All Seasons",27904660,19902880,38,0.0,0,
Fashion T500 Smartwatch Pink/Gold,3500,2000,43,4.7,3,"(4, 5]"
Fashion Large Capacity Canvas Bag Alphabet Tote Handbag Women's Bag Shoulder Bag,999,799,20,0.0,0,
"Dafii Maternity Pants/ Pads-Disposable Pads, Disposable Panties With Pad",12001500,8401000,33,4.8,19,"(4, 5]"
Adidas Adilette Lite Slides Men,5739,2499,56,4.9,9,"(4, 5]"
Fashion 4 In 1  Retro Braided Adjustable Mens Bracelets Hand Bracelet PU Leather,404,206,49,0.0,1,
Women's Casual Non-slip Leather Shoes Soft Soles,1185,790,33,4.7,3,"(4, 5]"
Smooth Satin Hair Bonnet/sleeping Cap/bonet Cap- Black.,550,390,29,3.9,14,"(3, 4]"
Fashion LEGGING/TIGHT Black JEANS LIKE,0,575,0,4.2,25,"(4, 5]"
Fashion Women's Sexy Star Moon Double-Layer Vertical Drop Bar-Silver,189,187,1,0.0,21,
Wlisth Luxury Men's Watches Stainless Steel Band Fashion Waterproof Quartz Watch,4115,2343,43,4.2,35,"(4, 5]"
Wahl Original Professional Icon Hair Clipper Shaving Machine,6000,2800,53,4.3,14,"(4, 5]"
Curtains With Sheer 3Piece Gray,44507450,34996499,21,4.8,15,"(4, 5]"
Adidas Streetahead W Women Running Shoes,11008,3841,65,4.9,7,"(4, 5]"
Fashion Stylish Ladies Leather Sandals,12991499,7701049,41,0.0,10,
Dr. Rashel Aloe Vera Moisture Cream 3 In 1 Day Mask Moisturizer,850,450,47,0.0,7,
Portable Shoe Rack 21 Pairs  7 Layers -black - Recommended,3200,1912,40,3.3,3,"(3, 4]"
Gas Delivery Pipe Plus Free Regulator (for 6Kg Gas Cylinder),900,585,35,4.3,10,"(4, 5]"
Fashion 2Pcs/Set Best Friends Tai Chi Yin Yang Hollow Pendant Split Matching Necklace,294,161,45,4.4,42,"(4, 5]"
Smart Collection New 94 Desire Men Perfume 48Hrs Last,500,329,34,0.0,4,
Okem Powerful Computer Electric Air Dust Blowers,3800,1852,51,4.8,4,"(4, 5]"
F9 Bluetooth Earbuds BT High Quality Sound With Powerbank,900,550,39,4.1,15,"(4, 5]"
Fashion 2 Pack  Turkey Men's Formal Official Trousers,0,23994000,0,3.7,40,"(3, 4]"
Men's Casual Business Leather Shoes Loafers Men's Dress Shoes,2120,1280,40,2.3,4,"(2, 3]"
Fashion N013 Ladies Luxurious Elegant Love Button Necklace-Gold-like,392,225,43,3.3,7,"(3, 4]"
Fashion Mens Solid Long Sleeve Dress Shirts,1510,815,46,4.3,50,"(4, 5]"
"Mekis Amla Rosemary Oil- Stimulates Hair Growth, Strengthens strands, Reducing thinning and promoting volume.",771,540,30,4.3,4,"(4, 5]"
Fashion 2 Sets Women T-shirts Clothing Female Short Sleeve,1398,899,36,4.1,77,"(4, 5]"
NIVEA Perfect & Radiant Detox Skin Care Pack,3000,2100,30,4.5,170,"(4, 5]"
Red Berry RSF1001 - Insulated Double Wall Vacuum Flask - 1L - Grey.,0,1020,0,0.0,1,
"Midea MMO-MM7P012MZE(BK) , 20L Manual Microwave Oven , 700W - Black",11000,7695,30,4.8,6,"(4, 5]"
Fashion 2Pairs Thick Silicone Transparent Bra Strap,494,299,39,3.8,4,"(3, 4]"
Wall Stickers Home Décor Accents Wall Stickers & Murals Not Canvas,1500,1200,20,3.8,5,"(3, 4]"
"Skin Beauty Products, Cosmetics, Jewelry, Drawer Storage Boxes 28*17*13",1845,1099,40,0.0,1,
Women Perfume Body Lotion Set Fragrance,778,399,49,0.0,0,
Aquafresh Aquafresh Fresh N Minty - 100ml,0,298,0,4.8,9,"(4, 5]"
"Mekis Chebe Powder-60g,Hair Strengthening,Hair Growth,Softening & Detangling",10911588,6601155,40,4.5,11,"(4, 5]"
Fashion Blue Light Blocking Glasses Anti Blue Light Glasses UV Computer Glasses,1082,580,46,4.3,3,"(4, 5]"
Fashion Retro Metal Round Rim Glasses,690,520,25,3.7,3,"(3, 4]"
Fashion Men Glossy Tassel Brogue Leather Shoes Loafers & Slip-ons Formal Corporate Black,2043,1053,48,0.0,2,
14Pcs/Sheet Waterproof Nail Sticker 3D Full Cover Wrap-20#,194,105,46,4.2,9,"(4, 5]"
L.A. Girl Pro Concealer GC983 Fawn,300,208,31,4.1,180,"(4, 5]"
Fashion 6Pcs Soft Cotton Brief Men's Boxers – Waist 29-35inc,0,1000,0,3.7,26,"(3, 4]"
Fashion Men's Palm Sandals Leather Shoes Comfortable Soft Sole Casual Black,1600,1190,26,3.8,4,"(3, 4]"
Miniso Men’s Long Handle Razor  - 10 Pack,0,359,0,0.0,7,
Fashion Men's Breathable Sneakers Lace up Sports Shoes Outdoor anti-slip Shoes Black,1200,899,25,4.7,3,"(4, 5]"
Amsterdam Modern TV Stand 4ft With LED Light,9499,7499,21,3.6,9,"(3, 4]"
Fashion Summer Men's Home Slippers Non-slip Lightweight Outdoor Bathroom Slippers White,755,385,49,0.0,5,
High Speed 64GB Phone SD Memory Driving Recorder TF Card,1289,669,48,4.2,110,"(4, 5]"
Nice One 6PCS 320ML High Quality Classy Whiskey/Wine/Water Glass (ES5004 GLASS CUP),999,799,20,0.0,3,
"Shea Africa Raw shea butter unrefined organic body,hair face shea butter pure shea for eczema,dandruff,acne,psoriasis",600,389,35,3.3,3,"(3, 4]"
Maybelline SuperStay 30H Active Wear Foundation- 61 WARM BRONZE,2400,1680,30,4.2,95,"(4, 5]"
3.5mm Male To Male Auxiliary Aux Cable,0,170,0,4.3,29,"(4, 5]"
Full Touch Screen Smart Watch - For Android & IOS,2388,1290,46,4.1,7,"(4, 5]"
Adidas Grand Court Base 2.0 Women Shoes,10255,5128,50,4.5,8,"(4, 5]"
Super Ducha Instant Shower Water Heater - Salty Water,2199,1465,33,4.3,9,"(4, 5]"
Fashion 2 In 1 Women's Sport Shorts Yoga Short Pants Summer Short Pants,856,437,49,4.9,7,"(4, 5]"
Fashion Jungle Green Men's Cargo Pant,20002500,16992000,32,3.9,71,"(3, 4]"
Ceramic Filter Element Household Tap Water Purifier Filter,1054,588,44,0.0,1,
Adidas Adilette Aqua Slides Women,4600,1999,57,4.7,6,"(4, 5]"
Miniso Weather Series Reed Diffuser - Misty Rain,0,399,0,4.8,6,"(4, 5]"
Fragrance World BROWN ORCHID GOLD EDITION 80ML EDP + Free Deo Inside,2600,1649,37,0.0,4,
4 Stand Mosquito Net With Metallic Stand-white,20002500,14301450,42,3.5,2,"(3, 4]"
Shea Fantasy Pure Shea Butter 2kg,3700,2900,22,4.6,52,"(4, 5]"
Fashion Casual Sneakers Mesh Men's Shoes - White,1265,1099,13,3.3,3,"(3, 4]"
Revlon ColorStay Makeup Combination/Oily Skin SPF15 30ml- Caramel,3273,1700,48,3.6,11,"(3, 4]"
Maybelline SuperStay 30H Active Wear Foundation- 63 CAPPUCCINO,2400,2299,4,4.4,61,"(4, 5]"
Men's Leather Belt Automatic Buckle Business Belts-Black,805,650,19,4.7,18,"(4, 5]"
Fashion Jeans Comfortable Slim Fit Men - Black,3000,16993000,43,0.0,321,
4you Automatic Water Heater & Boiler Electric Kettle +free Gifts,1250,1190,5,4.1,27,"(4, 5]"
"Fashion Men's Denim Jacket, Bomber Jacket, Hip Hop Denim Jacket - Black",2553,2149,16,4.3,35,"(4, 5]"
Fashion Men's Mesh Wearable Casual Sneakers,1599,1249,22,0.0,0,
Fashion Elastic Man Boxer Briefs  Knitting Cotton Underwear Men's Boxer Shorts with Box 4pcs,1000,620,38,0.0,2,
Fashion Knitted Beaines Skullies Beanies Bonnet -- Navy Blue,683,349,49,4.8,4,"(4, 5]"
Fashion 6-Pack Assorted Men's Woven Boxers,0,1199,0,4.4,27,"(4, 5]"
Fashion Men T-shirt Printed Slim Fit Short Sleeve,976,498,49,4.5,2,"(4, 5]"
Cute Shaggy Bedside Blanket Floor Mat Carpet-Dark Gray,941,628,33,0.0,3,
Fashion Unisex Knitted Beanie  Cap,0,399,0,0.0,0,
"Angelique Acetone 100% Pure,Professional Nail Polish Remover-60mL",299,249,17,4.1,38,"(4, 5]"
J55 TWS Earbuds Wireless Earphones Bluetooth V5.0 Headset Digital Display,1510,770,49,4.1,26,"(4, 5]"
Chris Adams Active Man Eau De Parfum -100ml,2100,1640,22,4.8,6,"(4, 5]"
Laptop Bag Case For Tablet PC Laptop Sleeve,19372337,1290,45,4.4,29,"(4, 5]"
Nunix  Aluminium Pressure Cooker - Explosion Proof - 5 Litres - Silver- High Quality,5800,3039,48,0.0,1,
Fashion Women Shoes Sneakers Sport Shoes Running Sneakers Casual Sneakers,1496,1299,13,4.2,71,"(4, 5]"
NIVEA MEN Deep Shower Gel - 500 Ml,0,1040,0,4.7,44,"(4, 5]"
A4 Fashion 2PCS Stylish Stretchy Printed Freesize Palazzo Pants (size 10-22),1200,799,33,4.2,6,"(4, 5]"
Cokelife Sachet Personal Water Based Lubricant Sex Gel,299900,190523,42,3.9,16,"(3, 4]"
Fashion HOTTEST Sports Bra With Extra Support Work Out Bra,600,549,9,0.0,59,
Mara Rosemary Essential Oil- 30ml,1000,800,20,4.5,72,"(4, 5]"
15pcs Nail Brush Kit Nail Art Tips UV Gel Nail Builder,560,280,50,4.8,4,"(4, 5]"
Modern Adjustable Double Rods- Antique Brass,24003999,16993099,29,4.7,3,"(4, 5]"
Bettar Acetone 100% Pure Gel Nail Polish Remover - 100ml,400,265,34,4.3,4,"(4, 5]"
"Mekis Chebe Hair Butter -  Stimulates Hair Growth,Strengthen hair, Prevent Breakage,",1299,799,38,0.0,3,
Fashion Men Sports Baseball Caps Casual Fashion Women Peaked Hats,1185,671,43,1.8,4,"(1, 2]"
Mielle Rosemary mint Scalp & hair oil infused with biotin for split end care ,2500,1614,35,0.0,1,
Maybelline Fit Me Powder  220 Nat Beige,1420,1268,11,4.6,29,"(4, 5]"
Fashion New Men's Breathable Black Leather Casual Shoes,1225,990,19,0.0,2,
Fashion G-Spot Mini Lipstick Vibrator Sex Nipple Clitoris Stimulator Dildo Massage Orgasm Anal Masturbator,800,459,43,3.8,5,"(3, 4]"
Premium Electric Dehumidifier Air Dryer 500ml Mini For Bedroom Kitchen,9825,5220,47,0.0,3,
Red Berry RSF810 Insulated Double Wall Vacuum Bottle – 700ml - Gold,0,792,0,0.0,4,
DP DISPLAY PORT TO HDMI CONVERTER ADAPTER,1000,693,31,0.0,6,
HP Invent Slim Optical Wireless Mouse 2.4GHz,960,579,40,4.3,10,"(4, 5]"
ZL02 Smart Watch H Full S Reen Sport Fitness Black,4990,2690,46,4.4,22,"(4, 5]"
Fashion Ear Studs Asymmetric Anti-rust Women Leaf Rhinestone-Golden,169,91,46,4.3,7,"(4, 5]"
Aichun Beauty  Hips And Butt Enlargement Oil,690,470,32,0.0,0,
Cantu Avocado Hydrating Shampoo with Avocado Oil & Shea Butter-400mL,1699,1199,29,4.3,3,"(4, 5]"
USN Blue Lab 100% Whey Protein 454g (1 Lbs) - Vanilla,0,3499,0,4.4,245,"(4, 5]"
Fashion Men's 2 In 1 Short Sleeve T-Shirt  - Black,1510,850,44,4.3,4,"(4, 5]"
Fashion Official Trouser Pant -Black-Slim Fit Office Wear Men,1500,10991500,27,3.9,31,"(3, 4]"
UNCOVER Sheet Mask Multipack Bundle,0,1050,0,4.7,113,"(4, 5]"
Oraimo Smart Trimmer Multi-functional Shaver,0,2299,0,4.1,14,"(4, 5]"
Charging Cable For All Android  Phones And Tablets,0,20,0,4.3,26,"(4, 5]"
Nice & Lovely Avocado Lotion 400ml,365,295,19,3.7,7,"(3, 4]"
4pcs Stainless Aluminum Sufuria Cooking Pots,2500,2400,4,0.0,0,
Fashion Official Laced Leather Shoes - Brown,3750,1899,49,3.8,19,"(3, 4]"
SWEET MEMORY Pearl Hairpins Clip Hair Accessories -5pcs/set,500,299,40,4.4,89,"(4, 5]"
Fashion Women Casual Breathable Sneakers,1729,882,49,0.0,15,
Fashion Stylish Mock Neck Ribbed Bodycon Dress(Hips 36-44inches Fit),1020,585,43,3.9,19,"(3, 4]"
Men Bags Backpacks School Bags Laptop Bags Satchel Bookbags,1999,1011,49,4.1,110,"(4, 5]"
Spring come 3-Pack Assorted Men's Woven Checked Boxers (Size 28-33),0,499,0,3.5,2,"(3, 4]"
HIGH SPEED DILDO WOMEN VIBRATOR SEXY ADULT TOY,1800,850,53,3.5,11,"(3, 4]"
3D Imaginative Designed Kitten Wall Stickers Bathroom Toilet Cover Decoration-Little Cat,221,147,33,4.2,9,"(4, 5]"
Dr. Rashel Black Mask Collagen & Charcoal Peel Off Facial Mask,600,344,43,3.9,9,"(3, 4]"
Fashion Jeans Comfortable Slim Fit Casual & Formal Men's - Blue,0,3000,0,3.9,219,"(3, 4]"
3D Fashion Ladies Body Shaper High Waist WHITE,1200,899,25,0.0,0,
Aichun Beauty Butt & Hip Lift Up Boosters Boosting Enlargement Cream-150ml,550,450,18,3.4,5,"(3, 4]"
Gotv Replacement Remote,0,700,0,0.0,3,
Fashion 7Pairs/Set Women Rhinestone Inlaid Sun Star Moon Stud-,339,210,38,3.5,13,"(3, 4]"
Plastic Artificial Plant Mini Coconut Tree Wedding-Green,99,57,42,3.4,5,"(3, 4]"
"Lightweight, Breathable Women's Casual Walking Shoes, Mesh Slip-on Sneakers - With Comfort Velcro",1893,988,48,0.0,0,
Fashion Nightglow Flame Dragon Necklace For Men's Fashion Glowing Dragon,399,299,25,0.0,0,
MAX MEN Penis Enlargement And Erectile Dysfunction Blue Max Man,1600,946,41,3.7,6,"(3, 4]"
Fashion Men's Printed T-shirt Slim Fit Casual Short Sleeve,1289,650,50,0.0,78,
NIVEA Aloe & Hydration Body Lotion For Women - 400 Ml,0,640,0,4.7,27,"(4, 5]"
"Fashion 4PC Duvet Set,Blue & White Star Print -comfortable",3551,24002620,32,3.4,29,"(3, 4]"
Sathiya 2L Electric Automatic Kettle-1500W,1500,998,33,1.8,4,"(1, 2]"
Fashion Handbag Black Underarm Bag Handbag Stylish Commuter Bag Shoulder Bag  Women's Bag Tote Bag For Women A Gift,1200,800,33,3.8,10,"(3, 4]"
Darkhorsir Earhook Wireless Bluetooth Earphone/Bluetooth Headphone/Bluetooth Headset F8 White,1219,698,43,3.9,32,"(3, 4]"
"Bioaoua Salicylic Acid Acne Removal Cream, Regulate Oil Secretion, Shrink Pores, Eliminate Acne, Lighten Acne Marks, ",550,284,48,3.7,13,"(3, 4]"
Sokany 6A 120W USB To TYPE-C Charge Fast Cable 200CM,698,379,46,4.1,17,"(4, 5]"
Fashion Cheetah Cork Slippers Comfy Flip Flop Shoes Sandals,800,749789,6,4.1,18,"(4, 5]"
NIVEA Creme Soft Shower Cream For Women - 500ml,843,798,5,4.5,33,"(4, 5]"
NIVEA Nourishing Cocoa Body Lotion 100ml,180,175,3,4.5,8,"(4, 5]"
Mara Aloe Vera Powder 100g,600,490,18,4.5,65,"(4, 5]"
L.A. Girl Pro Conceal High Definition Concealer -Cool Tan,400,208,48,4.4,9,"(4, 5]"
Fashion Loafers Cloth Business Men's Shoes-Grey,1699,990,42,0.0,1,
Fashion Ladies Shoes Athletic Shoes Casual Shoes Fashion Sneakers,1599,10991299,31,3.8,5,"(3, 4]"
Fashion Women Retro Golden Geometry Wafer Sequins Pendant Charm-,218,129,41,3.7,37,"(3, 4]"
Miadi Miadi Hair Food - 85g,0,107,0,4.4,7,"(4, 5]"
3.5mm Lapel Clip-on Handsfree Wired Microphone-Black,226,135,40,3.3,60,"(3, 4]"
"Aichun Beauty Pink Essence Cream For Sexy Pink&Tender Lips, Areolas And Private Parts(keeps Pink And Tender)-30g",600,361,40,0.0,1,
Queen Elizabeth Cocoa Butter Cream-Large Size-500ml,1600,990,38,4.7,38,"(4, 5]"
Phone Case For Samsung S20 Clear Cover,1500,999,33,0.0,1,
TCL Universal Remote Control,0,1099,0,0.0,0,
4-in-1 USB Type C Multiport Adapter Hub,0,5699,0,0.0,0,
Powerbank 30000mAh Fast Charging Portable,2500,1600,36,4.1,47,"(4, 5]"
Samsung 25W PD SuperFast Charging USB TYPE C Plug Alone EU,1450,799,45,0.0,3,
Lifesum Antiseptic Disinfectant Liquid  - 5L,0,650,0,4.9,10,"(4, 5]"
Mara Fenugreek Seeds-250g,0,500,0,4.6,134,"(4, 5]"
Heavy Stainless Steel Banana/Ark Fruit Rack,1200,894,26,0.0,0,
Nunix 20l Digital microwave with grill,0,9570,0,4.2,5,"(4, 5]"
56 fashion 3pcs Comfy Work Out Sports Bra Extra Support Bralletes,0,999,0,0.0,0,
Power King 6way Extension Power Cable + Free Gift,650,570,12,0.0,0,
Line One 100% Whey Protein Mass Gainer Double Chocolate 500g - Fast Muscle Growth - Post-Workout,5500,2849,48,4.3,74,"(4, 5]"
"Squatty Potty Simple Bathroom Toilet Stool, WHITE",1800,1650,8,4.7,3,"(4, 5]"
2500W High Pressure Steam Cleaner High Temperature,17670,9812,44,0.0,1,
3 In 1 EMSs Arm Abdominal Muscle Trainer Fat Burning,2000,1500,25,0.0,2,
13 In 1 Mobile Phone Repair Screwdriver Set,0,740,0,0.0,4,
Pyary Ayurvedic Tumeric Soap 12 Pcs,0,2000,0,0.0,1,
Fashion Official Slim Fit Shirt Navy Blue Turkey Style Long Sleeve,0,10991500,0,0.0,32,
Miracle Varicose Compression Stocking- Above Knee - Firm Compression - Seamless Nylon/Elastic Knit Stockings,19002200,14821716,22,0.0,0,
"Lenovo 1TB High Speed Micro SD Card For Tablets, Phones, Camera",0,3600,0,0.0,1,
HDMI Cable 1.5M,560,287,49,0.0,0,
Replacement Vision Smart TV Remote Control,0,1249,0,0.0,0,
"Mini Portable Electric Fascia Gun, Neck And Back Muscle Massage Gun - Pain Relief - Black",2762,1920,30,4.8,24,"(4, 5]"
"Mekis Epsom Salt For Foot Bath-300g/500g,Cleanses&Cures Toenail Fungus",606926,455590,36,4.7,33,"(4, 5]"
Unomat UPS-UM 650-Black,6800,5880,14,4.3,4,"(4, 5]"
Edifier TWS1 Pro2 Bluetooth Headset Aptx Bluetooth V5.3,8999,6599,27,4.3,4,"(4, 5]"
Fashion 6-Pack Men's Soft Cotton Underwear Boxers - ASSORTED,5501600,4991350,20,0.0,0,
tenda 8Ports 10/100MpsFast Desktop Ethernet Switch,2700,1799,33,0.0,0,
"Reinforced Simple Fabric Storage Cabinet, Dustproof Storage Cabinet - White",3366,2840,16,3.4,5,"(3, 4]"
Body Vibration Muscle Massage Fascial Massager,4899,2890,41,0.0,2,
Oraimo Smart Trimmer Multi-functional Shaver,0,2599,0,4.1,14,"(4, 5]"
H15 Phone Game Cooler Cooling Fan Radiator,999,555,44,3.9,7,"(3, 4]"
Fashion Mens Leather British Male Casual Shoes Business Dress Shoes Big Size Brown,586012560,29806280,53,4.5,4,"(4, 5]"
Phone Case For Black Cover For Xiaomi Mi 9 Lite,1800,1099,39,0.0,1,
Type C Fast Charge USB Cable,550,298,46,0.0,2,
20 Modes - 8 Speed Powerful Rechargeable Magic Wand Clitoral Massager,2363,1299,45,4.2,17,"(4, 5]"
USN Blue Lab 100% Whey Protein 454g (1 Lbs) - Vanilla,0,3499,0,4.4,245,"(4, 5]"
Mara Avocado Oil( Crude)- 125ml,600,500,17,4.5,208,"(4, 5]"
Fashion Photochromic Sunglasses Double Bridge Metal Glasses,1600,900,44,0.0,0,
NIVEA Nourishing Cocoa Body Lotion With Cocoa Butter 400ml (Pack Of 2),1280,849,34,4.7,1367,"(4, 5]"
Fashion Mens Sneakers Shoes Sports Shoes Breathable Running Shoes -White,2000,10001300,50,3.8,148,"(3, 4]"
"14""-42"" TV Flat Panel Wall Bracket Holder Black",450,245,46,4.1,2543,"(4, 5]"
Fashion Mens Sneaker Causal Breathable Shoes Light Weight Walking Shoes,2000,12001400,40,4.1,113,"(4, 5]"
Fashion Men Leather Loafers & Slip-Ons,1549,888,43,3.3,376,"(3, 4]"
"Rashnik RN-999 Blender & Grinder 1.5 Litres, 400W – Brown",0,1680,0,4.2,56,"(4, 5]"
RichRipple Desktop Mobile Phone Holder Portable Foldable Phone Stands,399,249,38,4.3,109,"(4, 5]"
Istanbul 2 Modern TV Stand With LED Lights,14000,6999,50,3.6,116,"(3, 4]"
Fashion 3 Pieces Of Adjustable Baseball Cap - Multicolour+free Gift,893,549,39,0.0,993,
YOIVY Teeth Whitening Essence Tooth Whitener Remove Stains,399,330,17,3.2,123,"(3, 4]"
"Home Design ROTATING 14""-55"" TILT MOVING WALL MOUNT BRACKET",1500,887,41,4.1,982,"(4, 5]"
Fashion Slipon Shoes Loafers Shoes Canvas Shoes Casual Shoes Mens Sneaker Black,12001500,729829,45,3.7,458,"(3, 4]"
LED 2.4G Rechargeable Wireless Mouse,931,470,50,4.5,1008,"(4, 5]"
Qwen 64GB Flash Disks USB Flash Drive High Speed,1000,699,30,0.0,403,
"Power King Extension Cable With 6 AC Power Outlets, 13A, And 2 M Long Cable",550,480,13,0.0,733,
RichRipple USB Rechargeable Beard Hair Trimmer Electric Hair Clippers Salon Hair Cutting Kit With Limit Comb,699,499,29,4.2,75,"(4, 5]"
L'Oreal GLYCOLIC BRIGHT FACE CLEANSER FOAM 100ML,850,634,25,4.4,296,"(4, 5]"
Vitron VB-Y44 - 2in1 Blender - 1.5L - 350W - White & Yellow,2999,1820,39,4.1,267,"(4, 5]"
Rashnik TV Wall Mount TV Stand For 14” -  42”,0,247,0,4.2,111,"(4, 5]"
Fashion 2024 Mens Casual High-Top Shoes Running Sneakers - Beige,2735,1860,32,4.3,316,"(4, 5]"
Qwen Aluminum Alloy Laptop Stand Computer Stand,1000,560,44,4.5,983,"(4, 5]"
Fashion Men's Casual Shoes Sneakers Sports Shoes,10991399,559629,55,3.4,16,"(3, 4]"
Fashion 6Pcs Soft Cotton Brief Men's Boxers – Waist 29-35inc,0,899,0,3.7,672,"(3, 4]"
Fashion Men's Trendy Sneakers - White,2223,1490,33,4.1,182,"(4, 5]"
Smartwatch Business Bluetooth Waterproof Sport,1074,587,45,3.2,138,"(3, 4]"
Fashion Mens Loafers Shoes Official Leather Loafer Casual Shoes Comfortable Shoes-Black,10001500,750999,33,3.6,67,"(3, 4]"
Garnier Brightening Night Serum With 10% Pure Vitamin C,2495,1692,32,4.4,99,"(4, 5]"
AILYONS FK-0318 Stainless Steel 3.5L Electric Kettle-Ultra Plus Kettle. (1YR WRTY),1999,1453,27,4.3,339,"(4, 5]"
RichRipple Pro2+ Bluetooth Headsets Wireless Pods Pro Earpods Earphones,754,599,21,4.1,213,"(4, 5]"
RichRipple 4in1 Pack Phone Camera Tripod Stand 1/4 Screw Head Remote Control Selfie,1499,999,33,4.4,70,"(4, 5]"
Fashion Men's Soft Sole Leather Shoes - Black,1614,980,39,3.5,203,"(3, 4]"
Gionee DCQ D1 Power Banks 10000 MAh,1500,750,50,3.9,345,"(3, 4]"
Fashion Sneakers Women Shoes Women's Shoes Ladies,9801048,639,39,3.6,334,"(3, 4]"
Fashion Ladies Sneaker Shoes Causal Shoes Buy A Size Larger Than Usual White,0,1500,0,0.0,448,
SiYi Sex Lubricant Water Based Lubricant Sex Lube-215ML,900,455,49,4.2,419,"(4, 5]"
ASHION 2024 Men's Casual Shoes Big Size  Sneakers 39-47,2331,1390,40,4.1,110,"(4, 5]"
Fashion Men Shoes Loafers Casual Shoes Slip-On Shoes Business Shoes,1398,699,50,3.5,72,"(3, 4]"
Fashion Mens Long Sleeve Dress Shirts - White,1190,599,50,3.7,79,"(3, 4]"
"Mosquito Net With Metallic Stand- Pink- 4*6, 5*6, 6*6",2500,1299,48,4.2,109,"(4, 5]"
"Max Man Ultra Form Penis Enlarging Cream Visible Result,Penis Enlargement-Blue",1000,522,48,0.0,2,
Fashion Tongue Cleaner Scraper Bad Breath Removing Oral-Pink,265,144,46,4.2,17,"(4, 5]"
Logitech C270 Webcam,0,4500,0,0.0,0,
CrazyLife MK III Penis Enlargement Oil Titan Penis Enlarge,399,350,12,0.0,1,
3 IN 1 USB 3.1 Type-C Male To Micro USB 3.0 2.0 OTG TF SD Memory Female Adapter Card Reader Docking Station,999,620,38,0.0,3,
Mara Ayurvedic Starter's Kit,2450,1850,24,4.7,88,"(4, 5]"
6 Speed LCD Touch Screen Fascia Electric Body Massager--Grey,3269,1980,39,4.1,14,"(4, 5]"
"Knee Brace, Adjustable Knee Support Wrap For Knee Pain, Arthritis, ACL, MCL, Joint Pain Relief",1510,770,49,4.7,3,"(4, 5]"
Contec Medical  Contec White Pulse Oximeter,3700,2800,24,4.9,7,"(4, 5]"
3Pack Ultra Comfy Cotton Men's Vest Assorted Black White Grey Men's Underwear,999,699999,30,4.7,3,"(4, 5]"
Mara Red Maca Powder- 100g,1200,900,25,4.6,14,"(4, 5]"
"Fashion 2pcs Men's Business Computer Backpack, Travel Backpack, Student Schoolbag-Black",2990,1580,47,0.0,0,
"Phone Case For Galaxy Tab A 8.0 2019 T290 / T295 Case, Dual Layer Heavy Duty Armor Tough Hybrid Shockproof Stand Protective Case Cover For Samsung Galaxy Tab A 8.0 Inch 2019",3588,2150,40,0.0,1,
Laptop Charger Flower Power Cable,490,279,43,0.0,4,
"Phone Case For Xiaomi Mi 9 Lite, Slim Silicone Rubber Shockproof Cover For Xiaomi Mi 9 Lite",1428,839,41,0.0,2,
Mara Brahmi Powder 100g,800,700,13,4.7,48,"(4, 5]"
Hemorrhoid Spray Herbal Cream Relieves Swelling Painless Itching Discomfort Redness Symptoms Avoid Contaminate Anal Care,3800,2450,36,0.0,0,
